,reviewId,userName,userImage,content,score,thumbsUpCount,reviewCreatedVersion,at,replyContent,repliedAt,appVersion,sortOrder,appId,month
420,1dc7d04c-4a68-48fd-85e2-3f48e2c98313,Muhammad parhan,https://play-lh.googleusercontent.com/a-/ALV-UjVWPmJkxMPpJGsG-Ve06T4S7x08cRsqe8TnW8JDsiEK59g,"ak tuh males bgt ttng updetan dari moonton, soalnya banyak hero skrng tu visual ny gk kayak dlu, ngerti ga?, dlu layla kek independent woman bgt wajah nya tpi skrng kek bocil 15 tahun, trs jg skill hero2 nya diubah kek terlalu friendly, tpi buat game game nya ga ngebosenin",3,0,1.8.21.8943,2023-10-17 16:29:53,,,1.8.21.8943,most_relevant,com.mobile.legends,October
421,c6cb5748-279c-4b34-a2a0-ff0661011a2c,IndRanesia,https://play-lh.googleusercontent.com/a/ACg8ocJZaL3kRXih63a-MOEeVj8PUgLW44iy272S-HiwxXY3ow=mo,"Jangan terlalu sering pembaruan, mau main jadi tidak optimal. Pembaruan jika hanya bikin berat lama-lama di uninstal.",3,2,1.8.21.8943,2023-10-17 18:21:08,,,1.8.21.8943,most_relevant,com.mobile.legends,October
422,d347ba87-6e55-4d7e-9d1d-f53e96b4232d,koncek Ijau,https://play-lh.googleusercontent.com/a/ACg8ocIJbLNuSVtu_F0UcgTL1jIEwXathb6l759BFOYupGlD=mo,Saya sangat suka dg game ini. Tapi ada masalah yaitu sinyal. tiap main tiba²sinyal hilang dan pas gue keluar. Besok nya tiba surat yaitu surat hukuman dari monton dan gue di ban selama satu hari.monton semoga sinyal nya di perbaiki,4,0,1.8.20.8941,2023-10-17 19:33:13,,,1.8.20.8941,most_relevant,com.mobile.legends,October
423,5173bed0-958c-4fd8-95fd-3f0a7ebb8082,Fadil M.fadil,https://play-lh.googleusercontent.com/a-/ALV-UjVMWfpNF7iOLmQsmjwZIcLHE79NISo4lndbkSCOv0bG13w,"Ya.. semoga moonton lihat ulasan gw, karna untuk update kali ini lumayan lancar cuman ada beberapa masalah misal frame rate tiba² drop, gw kasih saran moonton mendingan lu turunin penyimpanan ml supaya mereka yang ram² 2-4Gb juga bisa ngerasain gimana permainannya, ya.. jujur untuk update kali ini Bagus , soalnya saya udah bermain dari season 14. Semoga lancar terus game nya, dan untuk player² nya banyakin yang bagus² juga wkwk. Oke sekian terima kasih papi moonton",5,1,1.8.20.8941,2023-10-17 22:27:47,,,1.8.20.8941,most_relevant,com.mobile.legends,October
424,ab453030-730f-4e48-81a0-6db19b99b32a,NAND& BOS,https://play-lh.googleusercontent.com/a-/ALV-UjWktSrfHkRo6Hji_cshPHt-qkvXPXWSz9zw_SBxLmvIW_k,"Game nya bagus sih dari event yang keren dan banyak gratis nya tapi saat di gameplay itu terlalu berat sekarang tidak seperti dulu lagi dan tampilan lobby sekarang agak berat kalo ukuran game sekarang kecil tapi masalahnya di dalam game menjadi berat,tolong saya hanya ingin bermain yang nyaman bebas lag",3,12,1.8.20.8941,2023-10-17 23:36:34,,,1.8.20.8941,most_relevant,com.mobile.legends,October
425,6afcb52f-9e50-4003-8d11-af376cc5d525,Artha Yusa,https://play-lh.googleusercontent.com/a-/ALV-UjWqKzElIHIpnTnx8YdiI0KeSof2h2kiMrWHQ-Srr3XGnwc,"Sebenarnya dari semuanya udh bagus cuma dari segi penyemibangan tim kurang adil mengapa? Karena saya dapet tim yang matchnya masih dikit terus musuhnya udah beribu match dan ada yang suka ngetroll,ngefeed,afk dan lainya tolong seimbangkan lah timnya",3,0,1.8.21.8943,2023-10-18 01:47:46,,,1.8.21.8943,most_relevant,com.mobile.legends,October
426,d7b082f1-09c5-4a2c-a6d8-b0248653a9b1,20zrgb1GT,https://play-lh.googleusercontent.com/a-/ALV-UjU_JvxCEz9x_oIHau3r__ZtRDn9N3j-zZE7et-En_hNPA,"Kenapa setiap kali ada update, sinyal pada saat main selalu saja jelek, dan banyak fitur"" tidak muncul saat pertandingan meskipun file resource sudah di download kembali, tolong di balas",3,1,1.8.21.8943,2023-10-18 01:53:48,,,1.8.21.8943,most_relevant,com.mobile.legends,October
427,1e3454d9-15e8-4b9a-8dd1-d2da2e20112f,Queenzi Attalia,https://play-lh.googleusercontent.com/a/ACg8ocJpMESDVOhV79kVANnoEvFvfr1K-juVG_o7gNKzB2v8=mo,"Suka banget game nya tapi kenapa kadang suka force close 😭 padahal ram hp masih memadai terus masalah jaringannya juga waktu di lobby ga ada masalah pas masuk arenanya malah merah 😭 padahal jaringan juga bagus tolong lah moonton perbaiki masalah jaringan yang suka nge lag ini 🥲 dan ternyata banyak juga yang komplin masalah jaringan lag bukan hanya aku aja, jadi tolong yah diperbaiki ☺ nanti kalau sudah diperbaiki bintangnya bakal aku tambahin. Terimakasih ☺",3,1,1.8.20.8941,2023-10-18 02:48:11,,,1.8.20.8941,most_relevant,com.mobile.legends,October
428,26898276-c73a-4148-801a-fc64c867600b,aar sugiharto,https://play-lh.googleusercontent.com/a-/ALV-UjVFE8naESWFfc9SD5Mt3KlFpwaRt-lNzA0vCpJJoQjEpA,"Game yang keren! Banyaķ event yang tersedia, banyak hero dengan berbagai skill juga. Game ini menuntut kita untuk bisa bermain kompak dengan rekan tim demi meraih kemenangan. Percuma kalau jago pake hero-hero yang ada di game ini kalau bisa main kompak, susah menang. Kalian harus coba game ini, dijamin gabakal bosen.",5,4,1.8.20.8941,2023-10-18 03:50:47,,,1.8.20.8941,most_relevant,com.mobile.legends,October
429,89b811e6-5008-4e5d-b0e5-35499cf30184,Hayyi Ghara,https://play-lh.googleusercontent.com/a-/ALV-UjWK1WDHUHQaMaW173-0-16G0d62A18MOWgL53MYipA7txKE,Kenapa draft selalu dapat team goblokkk semua. Sering update tapi vidio highlight tidak ada gambar cuma suara payah. Buka pengaturan kenapa yang di tuju highlight padahal tujuan utama pilih pgtran tidak ke lihat vidio saja. Sudah ke vidio tp g ada gambar cuma suara,1,147,1.8.21.8943,2023-10-18 05:21:16,,,1.8.21.8943,most_relevant,com.mobile.legends,October
430,3429a089-1924-4b9e-a5ad-e6a7d3a96ea5,Azrul Fikri,https://play-lh.googleusercontent.com/a/ACg8ocLMmHSLnqprOgmPW3yOCzANaDw2nuLWszLy_KUKtmQH=mo,Game ini sangat seru mainya bisa ber 5 bisa sama teman..........aku suka game ini game nya bagus paling bagus di seluruh dunia...... tapi kalok di update penyimpanannya semakin tinggi itu yang gua paling gak suka......tapi aku suka game ini walau penyimpanan semakin tinggi...... aku sangat suka game ini....... seru banget,5,0,1.8.20.8941,2023-10-18 07:40:12,,,1.8.20.8941,most_relevant,com.mobile.legends,October
431,68131a01-e18e-4ebb-bdfa-937cff1dd3dd,Vicky Six,https://play-lh.googleusercontent.com/a-/ALV-UjXlLrB4gnp5y-CFMnshzwafwmIRL_dLujIC8tRjQN0qCw,"Saran aja sih untuk di back pack . Semisal item persiapan untuk prep yang emblem nya sudah full maximal dan kebanyakan memiliki magic dust . Saya saran kan ada penjualan magic dust atau bisa di tukar dengan item"" lain karna kebanyakan orang bertanya . Emblem full maximal tapi masih dapet magic dust dan numpuk sampe 100rb dan gak bisa di jual dan di tukarkan dengan item lain . Trs buat apa ??",5,0,1.8.20.8941,2023-10-18 07:46:13,,,1.8.20.8941,most_relevant,com.mobile.legends,October
432,5630a835-334c-4d82-b3d8-b450f1fd842d,Ajik Bagus,https://play-lh.googleusercontent.com/a/ACg8ocL5DzYHaz6Iz9r2ucc6WU4xDs9TURpL16WIbK6VktYX=mo,Tolong mooonton saya kasi saran ke mooonton. Dibaca baik baik. Saya sarankan moonton tau yang mana orang memberi saran dalam pertandingan dan berbicara kasar. Saya 75 kredit skor saya. Saya Berbicar bahasa indonesia salah berbicara bahasa Bali salah dengan sopan. Saya harus berbicara apa biar saya tidak di hukum dengan penurunan kredit skor saya. Kalo bisa cek itu dimana saya berbicara kasar. Kalo saya tidak terbukti berbicara kasar kembalikan kredit skor saya. Bosan saya 1 minggu maen cllasik,3,0,1.8.20.8941,2023-10-18 08:05:09,,,1.8.20.8941,most_relevant,com.mobile.legends,October
433,440a8907-90a2-45c2-9583-485749df5f2f,Muhammad Ristandi,https://play-lh.googleusercontent.com/a-/ALV-UjW8xjR77mAFUysk52KSkTMu7bO2DGw4sEaXEphzVNf5how,"Kenapa skin yg udh di download ilang semua, masa mau main download skin terus, terus kemana skin yg udah di download.. Udh update ini kok bukan nya nambah bagus, malahan nambah ngabisin kuota.",3,0,1.8.20.8941,2023-10-18 11:20:39,,,1.8.20.8941,most_relevant,com.mobile.legends,October
434,d681f948-dc1f-4275-87dc-82dafac0c786,etik yunita,https://play-lh.googleusercontent.com/a/ACg8ocKlKRflmb83vu_DYc4au6FJ3oRWZi8m4aQajdB1801h=mo,"Assalamualaikum Moonton ini game nya sih bagus tapi, UI nya tolong dijadikan UI lama lagi,soalnya UI lama lebih bagus. Sekian dari saya wassalamualaikum WR. Wb.",3,0,1.8.20.8941,2023-10-18 11:51:44,,,1.8.20.8941,most_relevant,com.mobile.legends,October
435,2568da3b-ee0b-4629-ad21-6bc982ba2f65,Irfan Syah,https://play-lh.googleusercontent.com/a-/ALV-UjUpF9fvdO3wKePxVmNZXO1dmRvrK_QwecFIpbJsSlitAg,"Aku naikin ini bintang 🌟🌟🌟 Karena tim nya udah pada bagus"" kalo kena mute gara"" di report player gak jelas padahal aku cuman bilang (pus) turret kena mute gara gara di report tim, memang sekarang gak ada player yang bawa"" agama,orang tua,ngatain, dan juga kalo kena mute pasti ada waktu untuk bisa kirim pesan lagi tapi aku di report gara"" bilang [puss turretnya jangan war terus] kena mute 2 jam baru bisa chat ulang tapi malah kena bug pula gak bisa kirim pesan hampir 12 jam 🫥tidak bisa apa""😭",3,1,1.8.21.8943,2023-10-18 11:58:03,"Dear Hero,
Terima kasih atas tanggapan Anda.
Silakan hubungi kami melalui CS dalam game, ini akan membantu kami mengumpulkan informasi yang lebih detail sehingga kami dapat mengidentifikasi masalah secepat mungkin. Bantuan Anda akan sangat membantu kami untuk menyelesaikan masalah dan kami sangat menyesal atas ketidaknyamanan yang ditimbulkan.",2023-10-19 04:24:03,1.8.21.8943,most_relevant,com.mobile.legends,October
436,8b0739a6-fc7b-442a-9974-2c04ba13122e,Sarapan diyo,https://play-lh.googleusercontent.com/a-/ALV-UjXRegH_6u22bGerRyZj7SguE2_lm-zSpx-TtGWwYloCcw,Game nya sih bagus cuman sinyalnya kadang suka merah padahal digame yang lain nya seperti pubg codm dll nya tu enak gak ngelag Lo moonton tolong ya di perbaiki soalnya ini juga termasuk keluh kesah pemain yang ada di in game woke... tolong diperbaiki lagi ya,3,0,1.8.20.8941,2023-10-18 12:24:31,,,1.8.20.8941,most_relevant,com.mobile.legends,October
437,e602a820-fc38-40b3-97b6-6d857dbb761a,Maykel Siregar,https://play-lh.googleusercontent.com/a/ACg8ocLawBnm6xs2bXfvpZTwTBWj8h6qlJhRpF-N_aRipxxX=mo,Saya sangat menyukai game ini.... Tingkatkan terusss... Performance nya... Soalnya saya sering afk gara2 Lag nya jaringan.... Padahal memori masih byk nya 6Gb ruang kosong... Tolong min ditingkatkan konektivitasnya iya utk Hp2 Standar.. agar dapat bermain lebih baik lagi.,5,716,1.8.21.8943,2023-10-18 12:59:20,,,1.8.21.8943,most_relevant,com.mobile.legends,October
438,7ed86b95-23d3-42ce-99a2-358180cb8b2f,Ahmad Sofan,https://play-lh.googleusercontent.com/a/ACg8ocLQvYgdQOyuI6Yja-vMKjehJAcyIS30BMzrdNb8YmRe=mo,"Entah lah ini yang ngerasain gw doang apa yang lain juga, sebelum update ni game masih aman² aja. Kenapa sekarang udh update game nya kaya makin berat yaaa tolong dong hargain juga yang hp nya ram 2gb buat moonton terima kasih 🙏",5,0,1.8.20.8941,2023-10-18 13:29:08,,,1.8.20.8941,most_relevant,com.mobile.legends,October
439,ea5ad214-e379-4b05-be0a-5bea3f9d40cc,Yoga A,https://play-lh.googleusercontent.com/a/ACg8ocILPHePJ6CLz9w-ixzaWWDNk1-0yuwYzqC3EC-ms6ji=mo,Gak konsisten mobilegend sekarang gak kompetitif dikarenakan penyesusaian hero dan team party terutama di mode rank dan ketika dapat team random selalu yang gak sesuai dengan sistem dengan level dan skillnya. Dan sungguh disayangkan akhir2 ini mobilegend terlalu terburu2 mem buff dan revamp hero. Sekian semoga difix,5,0,1.8.20.8941,2023-10-18 14:09:28,,,1.8.20.8941,most_relevant,com.mobile.legends,October
440,3322c4e1-aa01-4bf7-97d2-92876b86acb7,Carl Hopkins,https://play-lh.googleusercontent.com/a-/ALV-UjUIFK6G13Tr3VyukJ91IN740UvZiVacbvlVlsASuoG2ew,"Tolong di revisi kembali sistem matching nya, kenapa saya selalu bertemu dengan tim yang tidak bisa bermain dengan baik, hal itu membuat saya menjadi kesulitan untuk menaikkan rank saya karena permainan menjadi tidak seimbang, game ini 5v5 kalau ada satu atau dua orang yang tidak bisa bermain akan membuat teman satu tim yang lain menjadi terbebani. Saya harap dengan ulasan ini akan membuat sistem matching menjadi lebih baik. Terima kasih.",2,1,1.8.20.8941,2023-10-18 14:37:15,,,1.8.20.8941,most_relevant,com.mobile.legends,October
441,aacf33f3-b97d-45b7-9725-6699016efcf7,Rohman Ajah,https://play-lh.googleusercontent.com/a/ACg8ocIHa3OkSnbeMML1jzqDmUA3qODBHEOEL4Ln69Vd2q_j=mo,"Teruntuk developer yang terhormat tolong ketika keluar pertandingan sebentar trus masuk lagi. Pas login nya jangan di persulit lah,saya keluar sebentar gak nyampe 1 menit tapi tidak bisa masuk untuk melanjut kan pertandingan. Mentok di angka 60% sampe pertandingan selesai. Mohon untuk di perbaiki lagi!!!",1,38,1.8.20.8941,2023-10-18 15:53:13,,,1.8.20.8941,most_relevant,com.mobile.legends,October
442,38a38934-7cc8-4b57-8756-6e43ef391708,Jefri Sulean,https://play-lh.googleusercontent.com/a/ACg8ocJBMwv3TBasGIPJIp7561uAazkwlX0jtfHTtZxFeq2a=mo,"Makin tidak berguna game ini,capek buang waktu untuk game tak berguna ini...lag parah,tim tidak seimbang,cheater bertebaran,banyak makan memori seolah game ini hanya milik handpone yg mahal.....game ini sudah banyak keuntungan tapi GK mau menjaga perasaan para playernya.mari cari game yg konsisten memberikan kenyamanan semua player....",2,1,1.8.21.8943,2023-10-18 16:01:19,,,1.8.21.8943,most_relevant,com.mobile.legends,October
443,fd1fd151-71cc-4df6-9dc9-c83bc32af698,Arya Stark,https://play-lh.googleusercontent.com/a/ACg8ocI2mFJdyoheXVyLYudcrOLZUgOsdaoXbO9W1U8EOSmk=mo,"Unduh data hilang lagi unduh data hilang lagi begitu aja terus dikira download ngga lama apa. Makin kesini makin jelek sistem nya. Udah ngga layak di Mainin ini Game. Udah ngga ada feedback untuk para player, yang diutamakan hanya Event Top Up. Sedangkan para player punya Masalah di In Game tapi Tidak di Notice sekalipun oleh Monton",1,16,1.8.20.8941,2023-10-18 18:09:19,,,1.8.20.8941,most_relevant,com.mobile.legends,October
444,8d1011b6-3de8-4e7d-a772-c0b286550f54,Edy Syahputra,https://play-lh.googleusercontent.com/a/ACg8ocKxIE0HPwHfWaOMDrEBUkU_s4ksu2rrBYX0i_-yrlat=mo,Mohon semakin di apdet semakin ada ngelag nya sama satu lagi kenapa saat saya main itu player nya. Sangat tidak adil bagi ku tolong di perbaiki sekian terimakasih,3,0,1.8.21.8943,2023-10-18 23:36:40,,,1.8.21.8943,most_relevant,com.mobile.legends,October
445,58d14829-d201-4672-be9e-40fcfd22d193,Syarif 999,https://play-lh.googleusercontent.com/a/ACg8ocIGls3PConYP2b8h3hZfXokCCV5OKr39wgRz0Jwbg6L=mo,Gamenya bagus seru bisa mabar sama temen tapi untuk masalah jaringan kadang suka lag padahal paket data masih banyak kadang juga jaringan bagus tapi patah patah ngerame dan ngefrezee mohon di optimalkan lagi gamenya biar ga lag,3,1,1.8.21.8943,2023-10-18 23:55:18,,,1.8.21.8943,most_relevant,com.mobile.legends,October
446,ff097ca7-584a-44ba-bf4e-27e622517c78,RASYADA AJA,https://play-lh.googleusercontent.com/a/ACg8ocLx-ZvgI2TbOZvyO93b51KlGWI4AOYHOCOph2WvdzvV=mo,Knp g bisa main sih bukannya udah aku update kok g bisa main tolong d bantu knp saya g bisa main bukan nya udah saya update monton ini knp kok aku g bisa sih udah rela ngehapus file² malah g bisa d buka montng tolong d bantu penyimpanan sdah sya sediakan file² sya kurangkan mengapa masih g bisa main bisa d bantu sya cape gini terus pas login juga harus net work segala pas main jua dapet tim yg g bisa d ajak kerja sma dapet musuh pro semua tolong d perbaiki sya ingn kenyamanan saat bermain tlong,2,0,1.8.21.8943,2023-10-19 03:11:12,,,1.8.21.8943,most_relevant,com.mobile.legends,October
447,743757f4-02d8-42f1-9b49-a6ed299122e4,Firda Syahrul,https://play-lh.googleusercontent.com/a-/ALV-UjV2poS_AThX8JovAr4i1rBF9lOBlKpAOwgTkSZVUn_vDA,"Tolong lh moonton jaringan nya d perbaikin lagi setiap war slalu ada patah² bahkan ngeframe sendiri ampe lag nya parah. Padahal ram saya make hp Ram 8+3/128 mash aja nge lag, ngeframe, patah², bahkan sering ketemu player chet damage chet hack map chet percepat cooldwon",4,0,1.8.21.8943,2023-10-19 03:31:07,,,1.8.21.8943,most_relevant,com.mobile.legends,October
448,de0d7e8e-1f12-4bd7-b18b-f46b5927e807,Halimah NG,https://play-lh.googleusercontent.com/a-/ALV-UjWJaiFLiFXhcO5xKdg0-ETrwd8wEdufWzRWoWZ8Q7emQg,Untuk game ini udah bagus dan seru tapi tolonglah ml cobak benerin dikit update nya masak gua gak bisa liat hero gua sendiri kita mau nyepin event tapi selalu gak bisa malah di suruh download sumber data lagi dan lagi aku gak bisa main brawl jadikan gak puas klo mau main mode apa aja udah brawl gak bisa tambah tambah gak bisa main creaton camp sama mode lainya lah aku cuman bisa main classic dan ranked dan magic chees padahal aku gak magic chees padahal sinyal full tapi leg sekian terima kasih,4,1,1.8.8.8811,2023-10-19 06:10:10,,,1.8.8.8811,most_relevant,com.mobile.legends,October
449,6f939751-d929-4eb9-989f-fcba9b52d9ec,Abd. Latif,https://play-lh.googleusercontent.com/a/ACg8ocLK4Exu2V_xweiKW0RY8ayJfsUadGYIZ2uU_zY-tecJ=mo,"Semenjak update tuh jadi sering bug dan MALAH jadi makin banyak banget ambil penyimpanan, tolong lah kalo mau Update tuh Jangan gini, emang si grafik nya bagus, tapi buat apa grafik bagus kalo bug terus, Hadeh",2,280,1.8.20.8941,2023-10-19 06:19:21,,,1.8.20.8941,most_relevant,com.mobile.legends,October
450,a9798229-6b28-449a-a5f6-cc053d4b1e2d,Adam Laksana,https://play-lh.googleusercontent.com/a-/ALV-UjX0bN5-1kcrYcS-NAg5LiQLy3LqZV74vKoEiSHjEDVq9Ho,"Tolong donk benerin masalah dijaringan nya,setiap berhadapan dengan musuh pasti saja langsung lag pas ga ada musuh jaringan normal kan aneh,sudah di cek wifi aman ga ada masalah pake data aman ga ada masalah.",1,333,1.8.21.8943,2023-10-19 06:33:47,,,1.8.21.8943,most_relevant,com.mobile.legends,October
451,97474e3f-c1e9-4d0e-bd28-4a4b0083f87f,Moh.febrilman Arsyad,https://play-lh.googleusercontent.com/a/ACg8ocKOZul8_XKVvpHV55sOC-D60zCAKOpxhZeAv2o9355g=mo,"Moonton tolong perbaiki masalah jaringan wifi+data, kadang tidak bisa digunakan fitur tersebut. makasih",3,0,1.8.21.8943,2023-10-19 06:34:09,"Dear Hero,
Maaf atas ketidaknyamanan ini, silakan coba ganti jaringan terlebih dahulu. Jika Anda masih tidak dapat terhubung ke game, silakan hubungi kami melalui CS in-game atau email, sertakan ID game, ID server, perangkat, dan tangkapan layar agar kami dapat menemukan penyebab masalah Anda dan memberikan solusi yang akurat.",2023-10-20 04:00:54,1.8.21.8943,most_relevant,com.mobile.legends,October
452,9bd7b34c-000b-4cca-8060-5d3a2f53cc1d,My Jae Jar,https://play-lh.googleusercontent.com/a-/ALV-UjWaGKNddKdzD-qlmU8T50gw42n8LSeKjGcRnyEDVYaV2W4,Setelah update jadi agak kacau sering keluar sendiri atau mati aplikasi tiba tiba kecuali di hp harga 10juta keatas... :)))),3,0,1.8.21.8943,2023-10-19 06:44:51,,,1.8.21.8943,most_relevant,com.mobile.legends,October
453,0e0ee4dd-6fff-44b4-8299-f4284616d737,Dika putra Prasetya,https://play-lh.googleusercontent.com/a/ACg8ocJ-zUlsAz5DgQW1-Wnz32S0EB485aDrJwwcmfEf0Oqc=mo,"Oi gara gara ml penyimpanan gua full mau update aja g bisa, update di ml udah 100 update lagi, update di play store g bisa penyimpanan full tolonglah mikir montoon kami yg ram 2-3 masak harus beli hp lagi demi ml,dapet dari mana uang,inipun login lama,lemot sinyal lag gara gara ruang full, update lama lama tambah besar, update UI ,main patah patah lemot akhirnya afk,pas main pun musuh GK seimbang gua loststreak 9kali ngotak montoon anjng,mau pensi g bisa gua main udah 6 tahun toon,tolonglah",3,1,1.8.21.8943,2023-10-19 08:31:11,,,1.8.21.8943,most_relevant,com.mobile.legends,October
454,cfef9085-158e-4027-af0a-301f87141e21,Mahran Gaming's,https://play-lh.googleusercontent.com/a-/ALV-UjWH2UA2iALfapbAy_67wJJrykS8YCWGZoGHrHw_m-bA1g,Game nya sih bagus tapi kenapa setiap update harus ulang download data.padahal saya udah full download data loh.kan cepet habis jadinya kuota internetku. Mohon di perbaiki ya Moonton plissss,3,0,1.8.22.8944,2023-10-19 08:58:10,,,1.8.22.8944,most_relevant,com.mobile.legends,October
455,b8981e06-b24c-4c58-87cb-e5a797b833a3,Muhammad Yasar,https://play-lh.googleusercontent.com/a/ACg8ocKfEl4dl8SMw44-MZ0suaZOurLS4rncK9NqCK9ucgOA=mo,banyak bug sama saya sering mengalami for close yg sering game ini keluar secara otomatis terus pas login juga lama sama jangan kasih tim yang troll dan musuh yang jago tolong di perbaiki moonton🙏🙏🙏,3,1,1.8.21.8943,2023-10-19 08:58:23,,,1.8.21.8943,most_relevant,com.mobile.legends,October
456,234e7c45-5219-4ec4-b4da-5a68e22cd6d8,Tarwandi Sukasari,https://play-lh.googleusercontent.com/a-/ALV-UjWKJoczfKkxN1HUzFqeae_suCzm2CLIEEne1oxiT8Gx8Q,"We tolonglah minimal jan ngestack di 97% abis mental sendiri, kamu kira di ban matching tuh cepet, sinyal udah bagus masih ngestack udah ku relog beberapa kali juga ga mempan tolonglah bugnya meresahkan jadi kg bisa main 1 hari dahlah 😭",3,0,1.8.22.8944,2023-10-19 10:26:57,"Dear Hero,
Terima kasih atas tanggapan Anda.
Silakan hubungi kami melalui CS dalam game, ini akan membantu kami mengumpulkan informasi yang lebih detail sehingga kami dapat mengidentifikasi masalah secepat mungkin. Bantuan Anda akan sangat membantu kami untuk menyelesaikan masalah dan kami sangat menyesal atas ketidaknyamanan yang ditimbulkan.",2023-10-21 06:48:58,1.8.22.8944,most_relevant,com.mobile.legends,October
457,c91c5430-8cf1-43fd-8f27-796a1a25bab9,Yoga Satria,https://play-lh.googleusercontent.com/a-/ALV-UjUnuKW1mcoiusM1qAAHQcix0zaJqBh-FGJyV_syf3B-wA,"Moonton ini gimanaa data gua blm full tapi dah ada indikator download ceklist, pdhl di manajemen download gua pilih yang full data. Dan di hp gua kalok setiap main skill nya gak keliatan, mohon segera tindak lanjuti masalah ini",3,0,1.8.22.8944,2023-10-19 10:38:01,,,1.8.22.8944,most_relevant,com.mobile.legends,October
458,2fc4804f-2637-49db-81f0-b01fbe007764,Ridwansyah Sarmila,https://play-lh.googleusercontent.com/a-/ALV-UjWnqqTj7HxpaWQegbLfv7AZ2L6uNBqSm7XwUtavmYTyNg,"Oii... Kenapa data gue khapus mulu, uda donwload data, masuk ke server lain, data nya ilang lagi, kalo main ofline juga gutu, capek dowload data, bukan sdikit"" make paket",3,0,1.8.21.8943,2023-10-19 11:12:48,,,1.8.21.8943,most_relevant,com.mobile.legends,October
459,14e23075-d2be-4b35-8715-8781ad98d6d2,Ikbal Aman,https://play-lh.googleusercontent.com/a/ACg8ocJY9qduwtvkER7H7h-zSa2_rvOMvaWVfZZ4FCKkqSIg=mo,"Montoon ini kenapa gak bisa main gue udah kirim email berkali-kali tapi malah di balas ""mungkin gama mengalami stuck pada saat login"" Padahal yang muncul tulisan ""apakah anda memasuki mode offline"" jadi ML Hanya bisa pake Data wifi gak bisa ayolah montoon gue udah update tapi masih sama plis montoon teman teman ku juga gitu plissssssss banget😟😟😟😟",3,1,1.8.22.8944,2023-10-19 11:20:25,,,1.8.22.8944,most_relevant,com.mobile.legends,October
460,67989fb1-efa2-4c57-9f33-e62f9d0e1206,ASRI WAJO,https://play-lh.googleusercontent.com/a-/ALV-UjVWQI3CqdTYf_mhu9uxpCgfy6sccv-sjhxdtPo5za9xP2w,"Malam main game pas besoknya app nya ga bisa dibuka keterangan , ruang tidak cukup bersihkan dan instal ulang .. Montonn aneh jelas2 ram hp banyak malam game terinstal ulang .. bikin habis Kouta Wee moonton .",3,1,1.8.22.8944,2023-10-19 12:07:28,,,1.8.22.8944,most_relevant,com.mobile.legends,October
461,794f83d7-df52-44ed-9f79-2f219e91bf4a,Sam,https://play-lh.googleusercontent.com/a-/ALV-UjV0tgthAZed14x4eOLqqePdovi4gswFFMhOmeip96gUkA,"Tolong segera hero Harley dihapus dari mode mayhem, karena itu membuat pertandingan tidak sesuai, dan keuntungan hero harley yang dibuat di mayhem sangat amat merugikan bagi tim lawan, dan membuat pertandingan tidak seimbang",3,0,1.8.21.8943,2023-10-19 12:37:18,"Dear Hero,
Terima kasih atas tanggapan Anda, sudah kami catat. Kami akan membahas masalah dengan serius dan berusaha untuk meningkatkan pengalaman game yang sesuai. Jika Anda memiliki pertanyaan atau saran lebih lanjut, jangan ragu untuk menghubungi CS in-game, kami akan membantu Anda sesegera mungkin.",2023-10-20 08:07:49,1.8.21.8943,most_relevant,com.mobile.legends,October
462,d00d2ef4-e51b-49e1-ab1a-d8e0a66cee22,Two One,https://play-lh.googleusercontent.com/a-/ALV-UjWPDZVjpwChCtfzSpusZDKSXwUGFeacurG3wTZWyEPPNp8,"Moonton oh moonton........fokuslah pada perbaikan sistemnya, ping yang tiba2 tinggi saat war, perubahan model yang gak terlalu penting, perilisan skin yang cuman ganti warna, dll........",3,1,1.8.22.8944,2023-10-19 13:36:10,,,1.8.22.8944,most_relevant,com.mobile.legends,October
463,b87f8e3b-5392-4f20-a03a-f065605e3816,Sodron Kampret,https://play-lh.googleusercontent.com/a/ACg8ocL_ZsTOUyAXt7GMLmByry3eqE_EO6zwJoIs4JOKZNrL=mo,"Update terbaru meresahkan, terdapat bug jam pasir yang mengharuskan update resource berulang-ulang yang stagnan di progres 3/5,yang bagi user paket data sungguh memprihatinkan. Semoga patch terbaru segera diperbaiki dan lebih baik lagi, terima kasih. :P",3,1,1.8.21.8943,2023-10-19 14:27:19,,,1.8.21.8943,most_relevant,com.mobile.legends,October
464,39e4ec35-1f17-432b-84a3-9bebc90229f2,Grc. Berthram,https://play-lh.googleusercontent.com/a-/ALV-UjXozYEtx5IKQ-h5uR4iNcmWEPr0YSgShbm1zUuP4dPxolc,"Sangat Kurang puas dengan game nya. Apa yang membuat saya bilang seperti itu? Ya salah satunya adalah sistem matchmaking yang sangat tidak adil padahal saya sudah trio dengan teman saya dan kami sudah cukup untuk push rank bersama tetapi sistem nya tiba tiba selalu saja memberikan kami semua orang random/player random yang tidak bisa bermain, feeder, tidak tau roaming, dll jadi saya mohon moonton segera di perbaiki sistem matchmaking nya. Hal ini membuat game ml menjadi tidak adil",2,1,1.8.22.8944,2023-10-19 14:38:11,"Dear Hero, Kami bertekad untuk menciptakan lingkungan permainan yang adil untuk setiap pemain dan terus meningkatkan pengalaman bermain Anda, terima kasih atas dukungannya sampai saat ini, kamu dapat menghubungi kami melalui layanan CS dalam game dan memberikan lebih banyak ulasan dan informasi terperinci. Kami Akan membantu kamu secepatnya.",2023-10-20 03:58:03,1.8.22.8944,most_relevant,com.mobile.legends,October
