,reviewId,userName,userImage,content,score,thumbsUpCount,reviewCreatedVersion,at,replyContent,repliedAt,appVersion,sortOrder,appId,month
204,746a2e93-de81-4945-ae7f-431a497bee25,Alin,https://play-lh.googleusercontent.com/a/ACg8ocIB3K2S8QeibgLcNLyeyX_dsrbPBN2YPWcimKXyWfBxXw=mo,"This game is sooo good,but there problem. Nah gw kan udah legend, terus ganti season 30. Gw turun ke epic,disitu gw kalah mulu. Itu bikin gw kesel. Kalo main di rank lawan nya kuat banget. Sedang kan kalo gw main classic itu gw menang+dapet gold. But i still love this game,even though im always lose.",5,1,1.8.20.8941,2023-09-30 14:07:53,,,1.8.20.8941,most_relevant,com.mobile.legends,September
205,757bf46e-53cf-4d8e-9121-916ab4b78efd,Cloro Deagle,https://play-lh.googleusercontent.com/a-/ALV-UjX3ChphcDfQq-Wcs-NaTbfE8epTaSQvkh6h_lKjgMnf8Q,"Heran,tidak pernah berubah. Selalu dipasangkan dengan tim yang cacat sedangkan tim lawan terlalu kuat. Tolong perbaiki matchmakingnya! Lama kelamaan bosan memainkan game yang satu ini. Entah kenapa seperti di sengaja, kalah, menang,kalah, menang. Muak!!! Tolong untuk di pastikan keseimbangan heronya. Karena beberapa hero terlalu kuat dalam permainan contohnya x.borg dan lain lain. Mohon untuk sekiranya di atasi masalah ini",1,168,1.8.20.8941,2023-09-30 14:30:57,"Dear Hero,
Kami bertekad untuk menciptakan lingkungan permainan yang adil untuk setiap pemain dan terus meningkatkan pengalaman permainan Anda, terima kasih atas dukungan Anda sampai saat ini, Anda dapat menghubungi kami melalui layanan CS dalam game dan memberikan lebih banyak ulasan dan informasi terperinci. Kami Akan membantu Anda secepatnya.",2023-01-28 04:04:21,1.8.20.8941,most_relevant,com.mobile.legends,September
206,13ea0384-6194-4298-ab93-6d25a78a4810,Jamall Blangkon09,https://play-lh.googleusercontent.com/a/ACg8ocJ5BANwvGMQsTqpW-pwOohSKFD3VyKug8X90NFsnuQS=mo,"Makin aneh game ini, upgrade mulu, membutuhkan HP ram besar, kasihan yang ram kecil mau main tapi gak bisa, upgrade gak masalah kalo skin atau hero yg perlu di unduh bukan malah hampir semua hero jadi bulat harus di unduh dulu, malah nambah penyimpangan",3,5,1.8.8.8811,2023-09-30 15:12:40,,,1.8.8.8811,most_relevant,com.mobile.legends,September
207,3e19d663-ac81-433c-98c4-00d7b0a330f8,Matyu Pakan,https://play-lh.googleusercontent.com/a/ACg8ocKycMBOc2pXrLpKhTXW-UGKduPuOgNs1RSUYSS4FbmOGg=mo,"Kecewa sih kok habis update malah lama sekali pengecekan resource nya nggak kayak sebelumnya,gimana orang mau main dong padahal jaringan kua stabil"" aja nyoba main di game lain yang lebih berat dari ml lancar"" aja tolong yaa di perbaiki secepatnya",3,0,1.8.20.8941,2023-09-30 16:41:58,,,1.8.20.8941,most_relevant,com.mobile.legends,September
208,cf8191ae-f8ae-4618-a886-24d28de32b25,Bagus dwia Bimanyu,https://play-lh.googleusercontent.com/a/ACg8ocKAkGsYCd-ZJqJ7r9ZBlYKl4-rq1aZbqY-mgxwul2ox=mo,"Sebagai player yang sudah lumayan lama saya menemukan masalah baru yang membuat tidak nyaman berkenaan dengan resource data,tolong fix masalah ini singkatnya saat semua resource sudah di download tetapi sebagian hal seperti tampilan Hero,tampilan skil juga efek suara skill bahkan spell,juga slide yang ada di map tidak berada di sana sebagaimana seharusnya,dan itu sangat menggangu, ini sangat merepotkan mencari data data yang hilang dan memasukkannya sendiri satu persatu, ayolah tolong perbaiki!",3,112,1.8.20.8941,2023-09-30 19:14:44,,,1.8.20.8941,most_relevant,com.mobile.legends,September
209,ddd31aad-60f3-46f4-82e7-810fc8373785,Diah Prabaningrum,https://play-lh.googleusercontent.com/a-/ALV-UjVhTsei2T9e8TsGbK6SZrlVvg6sC0Trkkeuxae2O3FhDBY,"Game ini sangatlah bagus, suka mendoa kan orang tua,anak yatim,dan kata² nya juga sangat ramah, tapi setelah diupdate ada beberapa bug seperti sinyal yg tiba² jadi merah, tidak terhubung ke match dan lain sebagai nya,saya sebagai player nya juga meminta untuk kalo milih tim itu kasih tim yg bagus jngn kaya yg ngetroll gt..., Jadi risih main nyaa Segitu ajh terima kasih 🙏",4,1,1.8.8.8811,2023-10-01 00:54:41,,,1.8.8.8811,most_relevant,com.mobile.legends,October
210,effa30c6-6c72-4ab1-874f-165dd2a298f6,Vanvansky,https://play-lh.googleusercontent.com/a/ACg8ocKdCJ7a0AfrM-fTLR5gYTWKIjjqa8T4_F3TMFeuSeKV=mo,"Saya bermain Mobile Legend menggunakan HP Samsung S23 Ultra. Namun mengapa selalu saja patah-patah ? Padahal memori, RAM dan semua speksifikasi HP saya sudah sangat mendukung sekali. Harap ditingkatkan serta diperhatikan lagi peformanya ya 🙏",3,0,1.8.20.8941,2023-10-01 02:58:34,,,1.8.20.8941,most_relevant,com.mobile.legends,October
211,3b263a64-b7fc-4fa5-8898-111fe01d8732,Ahmad Rafi,https://play-lh.googleusercontent.com/a/ACg8ocKk5U0-0MMXXw_PriVY3f7hfOtJpMWEvXe17go2PKs6=mo,"Ada kekurangan dari game ini!! 1. Ketika download data jadi semakin lama padahal sinyalnya sudah bagus,, kalau dulu kan download datanya gak lama. 2. ketika bermain gw selalu ketemu tim yang b*t. 3. Tolong kalo baru download game atau baru hapus data game, tolong kalo di game jangan bulet-bulet jadi aku gak fokus ke dalam game,, mau download data lama. Udah segitu saya ulasan dari saya.. Tolong di perbaiki developer Aku kasih bintang 3 🌟🌟🌟 dulu Kalo udah diperbaiki aku kasih bintang 5",5,18,1.8.20.8941,2023-10-01 07:01:56,,,1.8.20.8941,most_relevant,com.mobile.legends,October
212,db1d0cc8-b86b-4a81-97d7-f238cbcd96a6,cakra dista,https://play-lh.googleusercontent.com/a-/ALV-UjUbdY51EuISJfQPsxxuATXuH3fceQ_FKJn5STik-GORoQ,"Tolong Devoloper kalau di mode Creator Camp, aku kan baru edit edit permainannya dan aku buat untuk umum pas udah mulai dan di pertengahan yang ada gambar gambar Hero musuh dan tim pas itu malah ada lag padahal sinyal bagus gw coba buat kaya gitu lagi 3 kali tetep gak bisa bisa tolong di perbaiki!",1,193,1.8.20.8941,2023-10-01 07:09:03,,,1.8.20.8941,most_relevant,com.mobile.legends,October
213,4892eed9-9605-49e9-9bbb-cc1ab1beb71c,Chacha Ramadhina,https://play-lh.googleusercontent.com/a-/ALV-UjWtrtjHWHlCrsSIXg0y_Tqz90aVMWceKjtXF9HeucvZbug,"Makin di update makin patah patah, padahal sinyal bagus. Terus, kalo ngasih musuh itu yg sepadan. Karena banyak orang yg capek kalo ketemu musuh/tim yg ""beda"" Banget dari biasanya. Tolong perbaiki lagi. Terimakasih.",3,4,1.8.20.8941,2023-10-01 07:37:49,,,1.8.20.8941,most_relevant,com.mobile.legends,October
214,9d1ea76b-cf64-4239-87f4-8a6b1bd763eb,Darrel Darrel Nararya Ozora,https://play-lh.googleusercontent.com/a/ACg8ocI7zQhGlVQWq0NYIt30tYex1MrZmQR_I5_BHtIRsbAL=mo,Game nya bagus grafik lumayan enak dah kalian harus download game nya itu agak toxic tapi lumayan lah terus kalau ada yang toxic langsung di sensor jadi gak akan muncul di chat nya tim atau musuh karna dianggap tidak sesuai dengan peraturan dan kalau ada citer gak bakal ada karna sebelum mulai moontun udah tidak memper ijinkan dari awal masuk jadi ayo download sekarang tapi mohon moontun untuk memperbaiki bug,4,1,1.8.20.8941,2023-10-01 09:42:23,,,1.8.20.8941,most_relevant,com.mobile.legends,October
215,427dfa45-95fe-471f-bba3-ff2b19f132eb,Nessa Purnawati,https://play-lh.googleusercontent.com/a/ACg8ocILRHAgqDaJy1w4cKvlDNke4UK2i0aRqTIPl1H30x72=mo,"Dari bintang 5 saya turunkan jadi bintang 2 Alasannya: game ini setelah update terus terusan jdi bnyk kurangnya seperti jaringan jadi tidak stabil,dapat musuh tidak sesuai sama kemampuan tim sendiri (rekan tim seperti bot sedangkan musuhnya pada jago"")",2,63,1.8.20.8941,2023-10-01 10:33:13,,,1.8.20.8941,most_relevant,com.mobile.legends,October
216,53069219-a6e8-40b9-93a8-e61dad42830e,Arya Saputra,https://play-lh.googleusercontent.com/a/ACg8ocK7EnQ8LWiPPpYqmDRkDamSomSn8erFh-InwXDf5gyF=mo,Untuk Moonton Tolong sesuaikan update Mobile Legends ini dengan ram ram hp tertentu ram 4 GB sudah full data tetapi kenapa tiba tiba Heronya menjadi smooth atau bulat bulat ini tidak tahu apa karena bug sistem atau handphone saya bermasalah tolong kalo ini bug sistem perbaiki dengan baik semoga dinotice,4,1,1.8.20.8941,2023-10-01 13:24:28,,,1.8.20.8941,most_relevant,com.mobile.legends,October
217,6c5a9135-8971-4328-8a74-fb7220178c34,Wahyudi Ariqin,https://play-lh.googleusercontent.com/a/ACg8ocIf3N8Wl-PP8BUfHK8vDKg2_7ZcPT8jlITwbCaiqyii=mo,"Mohon penyesuaian jaringan dan database dalam mode offline jangan mendownload ulang kembali , Masalah bug masih bisa di maklumi akan tetapi kalau ada pemain cheat langsung terdeketsi !!! CATAT BAIK BAIK MOONTON.",5,7,1.8.20.8941,2023-10-01 14:40:59,,,1.8.20.8941,most_relevant,com.mobile.legends,October
218,7ef1058d-da3e-470e-905b-c8ddb020f1a2,HANIF AKBAR,https://play-lh.googleusercontent.com/a/ACg8ocKxOzwz2gxuZ8FIrpE-i8b-qtQ81C7PugCFcjWxrleK=mo,"Game setiap bulan selalu update, tapi jaringan gak di upgrade, tolong lah kalau buat game tu jangan mikir penghasilan Mulu, mikir lah tentang para penggunannya,jaringan udh pakai yg cepat juga gk stabil, sebenarnya update setiap bulan itu memperbaiki tentang permainan atau untuk menambah penghasilan doang?",1,52,1.8.20.8941,2023-10-01 15:36:51,,,1.8.20.8941,most_relevant,com.mobile.legends,October
219,5b5ca662-08b0-4d4d-b256-dd65ec2524a5,Muhammad Gilang,https://play-lh.googleusercontent.com/a/ACg8ocLAgzz74NH8nZCaYZSNv5Z--8cT2H7J9eZLw43vIFcL=mo,"Mohon kerjasama tolong perbaikan masalah sinyal disaat war merah ijo terus tapi disaat mati langsung bajus, dan lagi tolong dipertimbangkan lagi rekan 1tim sangat tidak seimbang dengan musuhnya. Mobile legends sekarang makin berat. Menurut saya gamenya udah bagus seru ,banyak pelajaran yg bisa diambil.",1,1031,1.8.20.8941,2023-10-01 16:49:21,,,1.8.20.8941,most_relevant,com.mobile.legends,October
220,497a260a-5a9c-4761-9d92-0841922dcfe5,Ryan Florist,https://play-lh.googleusercontent.com/a/ACg8ocJEQfLvRgYp4dlAsHn24oyaJCGCuH196RbvVqeKMp0Y=mo,"Tolong dong ini di update malah makin banyak bug, patah patah setiap 3 detik, padahal penyimpanan masih luas, sinyal juga bagus, tolong perbaiki lagi🙏",3,0,1.8.8.8811,2023-10-01 20:12:47,,,1.8.8.8811,most_relevant,com.mobile.legends,October
221,bc4ea706-89fd-45ab-8a27-29a8794d0ff9,App Ninja Creator,https://play-lh.googleusercontent.com/a-/ALV-UjWp2VwadoxXntB8H5iuHJ173upU34-Tyt2n9gLz56bP9A,"Halo untuk moonton, game nya bagus, dan mudah untuk dimainkan, tapi tolong agar perbaiki disaat mode offline, Musuh atau computer itu ada bug, seperti, saat baru mulai tiba tiba computer tidak bergerak, melawan, kadang kadang muncul tiba tiba mohon diperbaiki ya :D",3,86,1.8.20.8941,2023-10-01 23:34:03,,,1.8.20.8941,most_relevant,com.mobile.legends,October
222,2ac61c99-1626-4304-9a07-644647cf4ef8,Akira Muzakki,https://play-lh.googleusercontent.com/a-/ALV-UjX_4b7CvAZBwhq5pFKtfoc7JSwRtdv1552NcThX6N0iA6s,"Overall sudah bagus, dari segi Grafik, Gameplay, sama penyeimbangan battefield, tapi ada beberapa yang setelah update yang op tambah op, yang udh perfect di revamp jadi tambah op, sehingga keseimbangan battlefield sedikit berat sebelah",5,8,1.8.20.8941,2023-10-02 00:12:57,,,1.8.20.8941,most_relevant,com.mobile.legends,October
223,7fdc31f1-64b2-4976-864f-0b7571bc0c75,Restu Persada,https://play-lh.googleusercontent.com/a-/ALV-UjVCr8RTXbiWpPYlzgMbESrfzpKebPiY5ujnS6tXgiTKow,"assalamu'alaikum, jadi gini bang. kenapa ketika pelayer main Reng itu selalu mendapatkan tim yang kurang seimbang gitu, dan kejadian itu sering bangat saya alami. jadi untuk developer tolong setelah update di mecth nya di kasih musuh seimbang ya. itu aja meksaih, (semangat developer)",5,4,1.8.20.8941,2023-10-02 03:09:34,,,1.8.20.8941,most_relevant,com.mobile.legends,October
224,6762e350-7989-4ed4-a43d-85f82cbd0b05,Jenese Sihotang,https://play-lh.googleusercontent.com/a-/ALV-UjUzaewrhvEE4_hYVmh4TQpI1MIMu9JN9SW9TxpI4as1s70,"Pihak MOONTON, sebaik nya animasi karakter hero diberanda segera lah di hapus, sebab karena tidak berguna, bahkan justru malah membuat ponsel nge lag saat animasi bergerak pada pengguna ponsel spesifikasi rendah. Terimakasih",2,7,1.8.20.8941,2023-10-02 04:41:08,,,1.8.20.8941,most_relevant,com.mobile.legends,October
225,870d4e56-95ca-4692-8418-a3ccb4d9c6f3,Yoga Aji,https://play-lh.googleusercontent.com/a/ACg8ocKJgSanzn185G7oZI_s869pCLwkIAjSXGjXAq-vr9d5=mo,"saya sangat kecewa untuk system pertandingan ,, pertandingan saya sudah ribuan kenapa dapat rekan tim yang pertandinganya 100 sampai 300 , dan sedangkan musuh level nya di atas level saya ,, kita main game untuk hiburan bukan untuk memperberat emosional .. sungguh game paling aneh untuk system pertandingannya",3,9,1.8.20.8941,2023-10-02 09:40:41,,,1.8.20.8941,most_relevant,com.mobile.legends,October
226,60c1bf62-fc31-4568-8a1d-22673b76d56d,Baln Kel,https://play-lh.googleusercontent.com/a/ACg8ocKElKo648hNNfkVTLpEMvTXwrHKQgixo8jyQod1gi0P=mo,"Ulasan season 29 udah bintang 5.tapi tidak dengan season ini😕☹️. Selama season ini signal saya selalu jelek,ping merah gantian terus, ada apa dgn update kali ini? Padahal signal 4G kata om service tower, towernya baik kok gak ada masalah.tapi kok signalnya jelek sih,akibatnya performa bermain saya jadi kurang memuaskan, hp saya pun jadi kena retakan jadinya saya buat😅 saking kesalnya dengan masalah ini",2,1,1.8.8.8811,2023-10-02 10:06:02,,,1.8.8.8811,most_relevant,com.mobile.legends,October
227,ecd23265-5091-4a6a-94c5-ab49ae8d2889,Cis,https://play-lh.googleusercontent.com/a-/ALV-UjUDTum48AhemYM1BnZK2dGEyBj43fjVE0w8SFnIIGFCUQ,"Kepada mobile legends Saya terlalu sering mengalami bug seperti hilang nya suara hero , basic attack hero, dan kadang-kadang data yang saya download di game hilang dan tampilan hero kembali menjadi bulat, saya sampe sempat mengunistal mobile legends saya beberapa kali, tapi setelah beberapa jam kembali seperti itu, jika ini bug harap di tindaki Terimakasih",3,8,1.8.20.8941,2023-10-02 11:05:03,,,1.8.20.8941,most_relevant,com.mobile.legends,October
228,46f51ade-159a-4c8f-b0bf-b45f39df0c42,king gaming,https://play-lh.googleusercontent.com/a-/ALV-UjWCxwoJeWfRoe8PtPO0GfxQ7DUykM-LzPKZbyvNtH0Nbw,"Saya mersakan frame drop di android saya ketika di android 12 hp saya masih lancar bermain dan tidak mengalami frame drop atau patah patah, tapi saat saya update ke android 13 saya mulai merasakan frame drop yang parah mohon untuk di komtibel kan lagi monton untuk performa di android 13.🙏🙏🙏😥",3,0,1.8.20.8941,2023-10-02 13:07:56,,,1.8.20.8941,most_relevant,com.mobile.legends,October
229,12923a64-63ae-4b79-8da4-08fc1049660d,Hade Bonbon,https://play-lh.googleusercontent.com/a-/ALV-UjXXhJ1CCyDDTVav2ER5NxjEleUxOhY8KwnOXu4meHdLkOc,"Harusnya biarkan player anda yang menentukan, konten dan grafis.contoh dia pakai grafis sedang. Biar player yg nentukan download pilihan sesuai system smartphone. Bukan anda. Jd tidak stuk di mengecek rescourse. Dan berulang ulang mengunduh konten. Hingga kuota internet habis 3 gb setiap hari.",3,0,1.8.20.8941,2023-10-02 15:11:59,,,1.8.20.8941,most_relevant,com.mobile.legends,October
230,0abcd1cb-1db6-4d29-80f5-7d86c2feab97,hry krnwn,https://play-lh.googleusercontent.com/a/ACg8ocKa3ErSOlyrCjduQagmlq7Mt1JdiTVKuOX6nNhafXwO=mo,"untuk ml versi terbaru ini sangat tidak menyenangkan, game menjadi terasa berat dan rasa ke-moba an nya menjadi seperti hilang karena adanya gambar Hero di depan, terjadi banyak masalah dimana semua data sudah full download tpi hero tetap telor.",1,107,1.8.20.8941,2023-10-02 15:51:38,,,1.8.20.8941,most_relevant,com.mobile.legends,October
231,2c64ef46-80f1-4778-97cd-e20d17a411c5,Muhammad Ilyas,https://play-lh.googleusercontent.com/a-/ALV-UjUajt3YqEd34WNMBsdy0GKEBsAfeez-DlYw0ItqxfO1aQ,Mobil legend makin lama makin parah keamanannya bener2 gak di perhatiin banyak yang ngecheat di arena. Sinyal sangat stabil tiba2 lag parah. Tolong perbaikin lagi masalah keamanan banyak banget tangan usil. Game aja bisa mereka menipulasi apalagi pas kerja nilep duit kalo min. Makasih 🙏,3,1,1.8.20.8941,2023-10-02 16:51:28,,,1.8.20.8941,most_relevant,com.mobile.legends,October
232,39d13b32-8fc9-490d-9251-32f5cd2ade98,Najwa Fitri,https://play-lh.googleusercontent.com/a-/ALV-UjVmfxMBtNa-4EyJncGkLjgjathD0j-guovRdwr8WgpZQzk,"Game nya seru, cmn kekurangan nya yaitu sinyal di game yg tiba tiba aja jdi jelek padahal sinyal di tempat ku bagus bagus aja dan juga tolong data di game nya jangan banyak banyak jdi nguras memori banget, pas awal download aja udh hbs beberapa GB dri penyimpanan. Itu aja sih selebihnya oke aja",4,0,1.8.8.8811,2023-10-02 22:26:24,,,1.8.8.8811,most_relevant,com.mobile.legends,October
233,f644fa5b-3d61-47dc-bdf5-28ecfe4fccb0,Uwais Alqarany,https://play-lh.googleusercontent.com/a-/ALV-UjVNbS-a9KB-FtamtPJzZDTUTIVXAXsT0mtdRed8c11pJyc,"Masalah jaringan tidak nyaman. Sebelum-sebelumnya meski kuning tetap bisa bermain. Sekarang meski hijau, kalau mencapai ping 80 hero nge-freeze, tidak bisa digerakkan. Selanjutnya hanya bisa menonton AI yang memainkan. Menonton itu tidak menyenangkan.",1,763,1.8.20.8941,2023-10-02 23:41:28,,,1.8.20.8941,most_relevant,com.mobile.legends,October
234,0dbf4694-0a3d-4b3e-a615-b5cf097198c4,Ktek alas,https://play-lh.googleusercontent.com/a/ACg8ocJoqqdhFhjWLYa7v17TERwaenvd49QJB-PWWRAFbNiG=mo,"Untuk Moonton tolong perbaiki masalah jaringan karena banyak bug jaringan yang saya alami padahal saya sudah memakai WiFi yang bisa untuk bermain game"" seperti ini, saya sudah mencoba melakukan double koneksi wifi & data tapi tetap saja masih terasa lag, dari memori internal saya masih luas 68gb tetapi game seperti terasa berat dibandingkan S29.",1,445,1.8.20.8941,2023-10-03 02:08:58,"Dear Hero,
Maaf atas ketidaknyamanan ini, silakan coba ganti jaringan terlebih dahulu. Jika Anda masih tidak dapat terhubung ke game, silakan hubungi kami melalui CS in-game atau email, sertakan ID game, ID server, perangkat, dan tangkapan layar agar kami dapat menemukan penyebab masalah Anda dan memberikan solusi yang akurat.",2023-10-04 03:12:28,1.8.20.8941,most_relevant,com.mobile.legends,October
235,f71f1c76-30bc-4fef-85fa-7454e1262189,Alwi Prasa,https://play-lh.googleusercontent.com/a-/ALV-UjUvjWS4_kJRGRcMuYWFgA26OSu7FetRvq2SeMNGGxED-co,"Game nya baguss tapi ada sedikit yg membuat saya tidak nyaman saya sudah download data dalam semuanya mengapa hero nya masih tidak terlihat dan masi bulat"" skin juga tidk terlihat padahal dh download data dalam semuanya",3,1,1.8.8.8811,2023-10-03 03:38:48,,,1.8.8.8811,most_relevant,com.mobile.legends,October
236,3a75d032-be31-481d-9537-da8b79896674,Alfarizi Sky46,https://play-lh.googleusercontent.com/a-/ALV-UjVYYblEgez_H2mkr5o6HSx0PHZ0WSUGOzlWF3cow-EwVQ,"Ukuran File yg terlalu besar sampai 7GB++, gameplay makin berat dan lambat, padahal pakai Grafik Rendah. Pada koneksi ping yg stabil dan aman... Mohon utk diperbaiki...",4,13,1.8.20.8941,2023-10-03 05:44:02,,,1.8.20.8941,most_relevant,com.mobile.legends,October
237,688c343f-9060-47f2-b448-3426cded5bb0,Fathya Khaira,https://play-lh.googleusercontent.com/a-/ALV-UjViq-zKirxcjJOR5wK8Eemo2ZXXfLSL7i8EDkbQS_AqFe4,"Semenjak update terbaru game mengalami penurunan sinyal dan sering crush, d tambah saya udh full update semua gambar Hero sampai skin smua hilang dan berat padahal hape baru cuma game ini doang yg online tapi malah kayak berat bgt dan sering lag. Tolong ya moonton saya jdi kurang nyaman dalam bermain masih mending season sebelumnya..",2,0,1.8.20.8941,2023-10-03 07:13:22,,,1.8.20.8941,most_relevant,com.mobile.legends,October
238,301d62d1-53b8-4001-9d51-b19b9f979ba2,Bayu Permana,https://play-lh.googleusercontent.com/a/ACg8ocKNDwJQjNRvgJDU2rnrrSKAaxGifIqD2-8lDrHahliM=mo,Gamenya bagus tapi tolong timnya ga sesuai sama musuh....... Terus kalo mau naik pangkat selalu ke drak sistem paling males kalo udah kaya jadi aku kurangin bintangnya jadi tolong perbaiki lagi!!!!!!!,3,3,1.8.20.8941,2023-10-03 08:47:35,,,1.8.20.8941,most_relevant,com.mobile.legends,October
239,db7822fd-7540-47f9-98c3-84931e1af466,Yare Yare,https://play-lh.googleusercontent.com/a-/ALV-UjVkECETMkDes53YPylwye_ze9QxxZY6KGBGMfSKtcXdlUU,"Sinyal yg buruk,gameplay yg tidak seimbang dan player yg toxic...itu semua pernah saya alami/temukan,apa lagi saat ada notif dan kita tidak sengaja ke tap,padahal tidak sampe 5dtk kita keluar game,tapi terpaksa ke realog,memang tidak masalah tapi yg bikin masalah itu saat bagian di mana kita ingin kembali ke game/pertandingan,di situ di suruh menunggu persenan untuk mencapai 100%agar kita bisa masuk ke game tapi di situ sangat2 lama untuk di tunggu bahkan butuh waktu sampai 10mntan...sekian.....",2,15,1.8.20.8941,2023-10-03 12:39:12,,,1.8.20.8941,most_relevant,com.mobile.legends,October
240,20965bb0-5791-4aed-82ce-a4777572e1ea,Hardika fiki Aldana,https://play-lh.googleusercontent.com/a-/ALV-UjXSMaFgGQ9Q5X4iEO9CfPNfAW2Eq4x4CrDR8SAP1MQRA4E,"Sistemnya sekarang benar-benar kurang ajar, pasti setiap kali dari epic 2 sampai legend 2 pasti reconnect sendiri terus menerus dan tidak bisa masuk ingame, padahal sinyal lancar banget, memori dan ram juga masih banyak. Mohon diperbaiki jangan bikin sistem yang kurang ajar",1,815,1.8.20.8941,2023-10-03 14:39:58,,,1.8.20.8941,most_relevant,com.mobile.legends,October
241,6933e915-9cf2-4bb7-b431-99f6f5e28506,Dr. Christopel Sinaga,https://play-lh.googleusercontent.com/a/ACg8ocKS-FV0MQ0eef_6OI6ngeRj_FAKdw_mAlzOxFFBYCFm=mo,"Beberapa kekurangan game ini: 1. Banyak pemain nge cheat/bot yg terkesan sengaja dibiarkan agar org2 tertentu menang dan memiliki statistik bagus 2. Jaringan kurang bagus dan tidak fair antar masing2 player. Terkesan ada player yg diberikan akses jaringan lebih baik dari yang lain 3. Statistik terkesan sudah diatur sistem. Ketika anda menang, selanjutnya akan dipersulit pada game berikutnya dengan modus, digabung dengan pemain2 statistik jelek, jaringan dibuat lag, banyak gerakan otomatis.",4,3505,1.8.20.8941,2023-10-03 14:58:01,,,1.8.20.8941,most_relevant,com.mobile.legends,October
242,d9119389-7fd0-45cd-8dc4-eb41c254f82f,YUDISTIRA DWI SATRIYA WIBOWO,https://play-lh.googleusercontent.com/a-/ALV-UjWDmxoXHPS_lBY2Y9Th-qHVgCNW0-LFBY3jElSbHi33eA,"Gak usah lah bagi bagi data yang didownload, bikin bug aja mulai dari gak bisa lihat demonstrasi skill, beberapa bagian hero jadi bulat, data hilang sendiri padahal gak ngaktifin pembersihan skin, kalo bisa ya kembalikan kalo gak ya dioptimalkan fiturnya biar gak ada bug lagi",1,219,1.8.20.8941,2023-10-03 15:11:46,"Dear Hero,
Mohon maaf atas ketidaknyamananya ya kak. Kami berharap kakak bisa memberikan tangkapan layar atau informasi yang lebih spesifik melalui CS in-game untuk membantu kami mengonfirmasi masalah yang dialami. Kami akan mengumpulkan feedback kakak untuk terus meningkatkan game menjadi lebih baik.
Terima kasih!",2023-10-04 03:09:56,1.8.20.8941,most_relevant,com.mobile.legends,October
243,f7b1916d-9e32-464c-bbcf-d6378b75a0b3,Indriyani indri,https://play-lh.googleusercontent.com/a-/ALV-UjVBkgmDpPsSwnVCS6b0YUG8dl8419dXu41hw0rLRi3KkQ,"Yth moonton game sudah sangat bagus, terima kasih banyak. Tetapi saya mau menyarankan kalau bisa agar lebih teliti lagi untuk player solo rank karena terkadang saat match making banyak terdapat player random yang mainnya kurang bagus karena pengalaman bertanding mereka masih sangat kurang untuk itu kalo bisa pada saat match making agar di filter dan di sesuaikan rekan tim yang sekiranya pertandingannya mendekati atau dalam satu tim itu sama atau imbang, kiranya menjadi bahan pertimbangan..",5,34,1.8.8.8811,2023-10-03 15:42:12,,,1.8.8.8811,most_relevant,com.mobile.legends,October
244,f13ac343-7fc5-43fb-9cee-f80da91c046f,Aku Zxevan,https://play-lh.googleusercontent.com/a-/ALV-UjW4dHuo8kPRaejsr6zHvU6UHYAcJh97yw26XipPYPr_2Q,"Setiap main pas di loading main pas baru mulai harus nunggu bisa sampe 5 mnit lebih, terus ada suara ""nging"" padahal hampir grafik semua hampir rata kiri, resource aja pilih 1. Dapet tim diranked bagus diawal 1 match dpt bagus giliran match ke2 smpe setrusnya dpet dark system, dapet tim ngetroll, yang match nya masih puluhan lah. Grafik hampir semua rata kiri kok masih bisa frame, freeze. Ini saya kasih bintang 1 semoga diperbaiki, yang di fix itu sistemnya malah byk event sama update.",1,306,1.8.20.8941,2023-10-03 17:07:16,,,1.8.20.8941,most_relevant,com.mobile.legends,October
245,a6e145d7-b885-4dc9-b0ed-cb5c45c887ff,Bagus Purwanto,https://play-lh.googleusercontent.com/a/ACg8ocLcae2Z71Zlo9oaCCiRR28VjH1xp0znx9vLqW2tMcYo=mo,"Terjadi masalah pada download resource yang gak bisa dijeda , itu smcam bug atau apa ya , tiba² kuota kesedot abiss tolong segera perbaiki biar bisa dijeda , jadi bisa download yg diperlukan saja terima kasih 🙏😊",3,0,1.8.20.8941,2023-10-03 21:33:47,"Dear Hero,
Terima kasih atas tanggapan Anda.
Silakan hubungi kami melalui CS dalam game, ini akan membantu kami mengumpulkan informasi yang lebih detail sehingga kami dapat mengidentifikasi masalah secepat mungkin. Bantuan Anda akan sangat membantu kami untuk menyelesaikan masalah dan kami sangat menyesal atas ketidaknyamanan yang ditimbulkan.",2023-10-04 03:07:53,1.8.20.8941,most_relevant,com.mobile.legends,October
246,3b4cf230-99c1-4a67-8cdf-be942abcba0a,Jaka Perdana,https://play-lh.googleusercontent.com/a-/ALV-UjVP0I1QeGhYr9f7ZJAOuU8x-C5CcYv9ZZsqvj9igYGDEe4,"Sekarang game ini terus mengalami kekurangan performanya, makin berat, makin banyak cheater, makin banyak kekurangan nya saat ini, jangan hanya grafik terus yang di tingkatkan, keaman server juga perlu agar permainan berjalan lancar dan menyenangkan tanpa adanya kecurangan dari cheater",4,0,1.8.8.8811,2023-10-03 22:33:25,,,1.8.8.8811,most_relevant,com.mobile.legends,October
247,a39c7a3c-2cca-47b6-9376-4e98c002d511,Hoxz_,https://play-lh.googleusercontent.com/a-/ALV-UjXJrJP2rrlg8NU0Jmw2-aNd-z9E5k3Id_P80dr69aQoV5Y,"Gamenya sudah bagus, tapi kak kenapa saat update di ml saya pengaturan manajemen konten sama highlight nya hilang, lalu saat saya mau membuka even sama star light tiba tiba layar saya hitam, padahal saya sudah update yang terbaru. Tolong di perbaiki ya",4,2,1.8.20.8941,2023-10-04 02:54:38,,,1.8.20.8941,most_relevant,com.mobile.legends,October
