,reviewId,userName,userImage,content,score,thumbsUpCount,reviewCreatedVersion,at,replyContent,repliedAt,appVersion,sortOrder,appId,month
767,c221dfe7-eb1d-4652-b341-873d53cbbbcf,Rul ????,https://play-lh.googleusercontent.com/a/ACg8ocJS7iUUqjHxjOT_63_pKxcAylf6UWTDKifq7J3WE9dv6g=mo,Babi Lu Monton Moga Esok Mati Lu Udh Di Kasih Bintang Lima Malah Lose Bukan Win Ajg Lu,2,0,1.8.22.8944,2023-10-25 14:25:06,"Dear Hero,
Kami bertekad untuk menciptakan lingkungan permainan yang adil untuk setiap pemain dan terus meningkatkan pengalaman permainan Anda, terima kasih atas dukungan Anda sampai saat ini, Anda dapat menghubungi kami melalui layanan CS dalam game dan memberikan lebih banyak ulasan dan informasi terperinci. Kami Akan membantu Anda secepatnya.",2023-07-07 03:27:46,1.8.22.8944,newest,com.mobile.legends,October
768,a7dfb917-ef78-4ae6-b68a-ba9e01f6e8e0,Mahmudi,https://play-lh.googleusercontent.com/a/ACg8ocIog7qLKfE8KkfcGaecLisLRF-CEUakkcpTc3Uc8DZm=mo,Saya pengen kasih saran kalo main solo ketemu nya solo semua lah masak solo ketemu duo atau terio susah jadinya,3,0,1.8.8.8811,2023-10-25 14:27:47,,,1.8.8.8811,newest,com.mobile.legends,October
769,e926626c-a354-45e1-8ed5-365b95ce5ac1,moskof tik tok,https://play-lh.googleusercontent.com/a/ACg8ocLHHPC-1l7J2-ZGCWwIsYPBQv_XrQLlKjULLFNaV4uP=mo,Heh game ini bagus tapi matching nya apa cok aneh kadang jumpa musuh nya jago lepas selesai match tiba tiba offline semua aneh bgt kayak lawan bot dan setelah melawan bot tersebut nemu lagi musuh yg noob bgt dan selesai match ya tetep offline semua tiba tiba aneh kadang menang kalah nya itu berpola menang sekali kalah empat kali gitu trus cok,2,0,,2023-10-25 14:34:11,,,,newest,com.mobile.legends,October
770,6d287f10-7c87-49b3-a504-2a102a929e88,panorama egi,https://play-lh.googleusercontent.com/a-/ALV-UjU14kHDJHnkAAfQgseMNE00b23zkG5OyQU60d50OBq-cQ,Tolong game ini di perbaiki karena banyak orang² yg mengeluh karena dapat tim yg gk seimbang sampai² ketinggalan jauh ranknya.,2,0,,2023-10-25 14:34:26,,,,newest,com.mobile.legends,October
771,d775f458-2b94-41fa-bcbc-392f0b4bfb36,Diki Aldiansyah,https://play-lh.googleusercontent.com/a-/ALV-UjUa47RUk2zBstJzW00RJsI3rt42L20UQAGBPB8F3XT6IXg,"Om Monton kasih musuh yang imbang donk biar mainya nyaman kan enak, ini kaga kasih musuh kaya kasih lawan miytik gitu gitu gg lagi Sajankan tim nya bejat semua kasih lah yang imbang lah Monton pliss lah🥲",2,0,1.8.20.8941,2023-10-25 14:34:54,,,1.8.20.8941,newest,com.mobile.legends,October
772,8f6df5f1-5d80-48bb-8fde-14afa1d261a5,ANDREAN Wijaya,https://play-lh.googleusercontent.com/a/ACg8ocLMwpqro4h82qc4OlcQ84og77FrPp9LXmmEZKGLbRBA=mo,Saya kasih bintang 5 kalau kagura damage untuk antena di naikkin soalnya musuh beli antena kita gk ada damage sama sekali,4,1,1.7.94.8681,2023-10-25 14:36:20,,,1.7.94.8681,newest,com.mobile.legends,October
773,386c3e0e-0566-49be-8740-17b21db85f0d,Santri Pala santri,https://play-lh.googleusercontent.com/a/ACg8ocIjP0-8AU8uqn5fEfOYtj8xSEyHmefL0pGfVkFZHBnq=mo,ml k0n th0l nga bisa kasih orang win. Menang sekali kalah 30 kali k0n donwload mahal . Ksih tim kek k0n. Dapet tim cewek semua k0n,4,0,1.8.22.8944,2023-10-25 14:41:49,,,1.8.22.8944,newest,com.mobile.legends,October
774,d12850b0-75f7-4396-9b8d-702911a54deb,Jovan Christian Official,https://play-lh.googleusercontent.com/a-/ALV-UjV8ztYIS7r9mg5-w8L2mEBmgWqTMQlLindhhzRO1CJtF_E,kurang baik untuk kesehatan mental.. tapi kalau untuk pro player ya aman aman ajah..👍😅,2,0,1.8.22.8944,2023-10-25 14:42:30,,,1.8.22.8944,newest,com.mobile.legends,October
775,a7af8d6e-fc8b-48ce-9829-a65a14e7e44b,Badak Gaming,https://play-lh.googleusercontent.com/a/ACg8ocIT5wI4nPFsm-dknHU3SCauQNc-EX8Wl0s18Wpa_OnxqQ=mo,Ijin ijin dan sorry sorry Sorry sorry Ijin ijin ijin ijin dan maaf maaf maaf,3,0,1.7.58.8261,2023-10-25 14:46:02,,,1.7.58.8261,newest,com.mobile.legends,October
776,e8c3db83-3e3e-468f-9f18-f28aae114c5a,79 Evis Isti Muna Tifa,https://play-lh.googleusercontent.com/a-/ALV-UjWVzdhvBNB1iEtOqhw6c7rJcB4UZBfu5UK8jnirqOqZwgw,"males ah kgk bisa mode offline lgi, gembel.",2,0,,2023-10-25 14:46:50,,,,newest,com.mobile.legends,October
777,ec2c0a36-8d6f-4871-bcef-649bb2ddf993,Bayu Prawira,https://play-lh.googleusercontent.com/a-/ALV-UjXBe-igRHhUkwcWHU0fNPoglf5fLHH3OyU0NlMU4GPBRlM,"Mohon untuk MOONTON tercinta, berikan misi gratis tambahan, entah kita sebagai player mendapat skin basic atau pun yang lainnya ( seperti misi nostalgia ).jadi kita sebagai player gratisan menjadi rajin bermain mobile legend tercinta ini. Kan nanti juga timbak balik. Sekali lagi, tolong lebih banyak kan event misi gratisan yang membuat player sibuk bermain ml jika bosan bermain sosial media🙏",4,84,,2023-10-25 14:55:59,,,,newest,com.mobile.legends,October
778,01ba3f5c-4567-43cb-9906-5fa79b2679e3,Patarani Hasmiwadana,https://play-lh.googleusercontent.com/a-/ALV-UjWOWRQYscn7gt4QrtCX7WMnWZ3cyt9D5zIbmdBYWgQhvA,Semua di gemmm ini bgus cuman dowlod data nya jangan dalam gemmm lah,4,0,,2023-10-25 14:56:24,,,,newest,com.mobile.legends,October
779,d7360fb1-8b78-4ebc-b161-a261c80c770a,Ubay Bae,https://play-lh.googleusercontent.com/a-/ALV-UjW24kaqUFLurqsm2vFrltuJMH2mT0HNMUhU4qc1dTLgGw,Game Bagus grafik ok hp kentang seperti saya masih bisa main tapi yang jadi masalahnya adalah 1 tim gajelas ini paling sering saya temui mulai mainya gamplaynya terus suka blunder gitu kaya sengaja 2 dark sistem ini paling sedikit sih saya liat konten orang orang yang mau mitick pasti kena troll,3,0,1.8.20.8941,2023-10-25 15:00:03,"Dear Hero,
Kami bertekad untuk menciptakan lingkungan permainan yang adil untuk setiap pemain dan terus meningkatkan pengalaman permainan Anda, terima kasih atas dukungan Anda sampai saat ini, Anda dapat menghubungi kami melalui layanan CS dalam game dan memberikan lebih banyak ulasan dan informasi terperinci. Kami Akan membantu Anda secepatnya.",2023-03-08 07:06:03,1.8.20.8941,most_relevant,com.mobile.legends,October
780,d7360fb1-8b78-4ebc-b161-a261c80c770a,Ubay Bae,https://play-lh.googleusercontent.com/a-/ALV-UjW24kaqUFLurqsm2vFrltuJMH2mT0HNMUhU4qc1dTLgGw,Game Bagus grafik ok hp kentang seperti saya masih bisa main tapi yang jadi masalahnya adalah 1 tim gajelas ini paling sering saya temui mulai mainya gamplaynya terus suka blunder gitu kaya sengaja 2 dark sistem ini paling sedikit sih saya liat konten orang orang yang mau mitick pasti kena troll,3,0,1.8.20.8941,2023-10-25 15:00:03,"Dear Hero,
Kami bertekad untuk menciptakan lingkungan permainan yang adil untuk setiap pemain dan terus meningkatkan pengalaman permainan Anda, terima kasih atas dukungan Anda sampai saat ini, Anda dapat menghubungi kami melalui layanan CS dalam game dan memberikan lebih banyak ulasan dan informasi terperinci. Kami Akan membantu Anda secepatnya.",2023-03-08 07:06:03,1.8.20.8941,newest,com.mobile.legends,October
781,3427b826-d7a5-4a50-9100-56981e7c3aac,Heri Ng,https://play-lh.googleusercontent.com/a/ACg8ocIILMX2_pWmu_71Fo649_kW7qv7viUuvCn9T3w-2xfu=mo,"gatau kenapa tapi gw lebih suka mode offline nya, tapi gabisa katanya internetnya ga bisa, padahal dulu bisa jadi ya ini gw g tau ini bug atau engga tapi pleasee muntun",3,0,1.8.22.8944,2023-10-25 15:01:58,,,1.8.22.8944,newest,com.mobile.legends,October
782,470e44ad-eb93-42cb-8bbd-bf1ce661f5cc,Bajing Kekes,https://play-lh.googleusercontent.com/a/ACg8ocK13Ihy0YT4fdBvk2lVSUnh97INXt2T0pu7NP9KPRjL=mo,Yang bner dong anj kalo kasi tim itu yang benr setan caoe aku kna drak sistem monton terus caoe anj mikir dong,2,0,,2023-10-25 15:03:54,,,,newest,com.mobile.legends,October
783,3147a45f-0543-45d6-9f79-58ea45c9d140,Wah Yudi,https://play-lh.googleusercontent.com/a/ACg8ocK7-5oIYD5IfhPh1pOYNfu165bgNnu1v1oxM_2FI4dQ=mo,"Ini gem yang bener aja sih kalok buat tim kenapa gk seimbang susah di mengerti 1 kali kalah seterus nya tetap kalah trus tim dapet yang Abal"" gk seimbang Yang ada jengkel doang ni ton monton",2,0,,2023-10-25 15:05:42,,,,newest,com.mobile.legends,October
784,b4268787-9b66-4a7c-9446-8598d7750dd9,Rizki Nur,https://play-lh.googleusercontent.com/a/ACg8ocKCvfX-UEgRPn5TYubLXPvaYXE8Xoy9ZKmfUXYO03Zv=mo,aku kasih 3 dulu ya,3,0,,2023-10-25 15:09:41,,,,newest,com.mobile.legends,October
785,8dcb62a7-1c10-4e1d-a142-d37e9dc47755,jisoo soya,https://play-lh.googleusercontent.com/a-/ALV-UjWVHTfv70UIvtZWjDQmVxkqe57OGHG13wYQZh6KyxaHkA,makin sini makin sini jaringanya jelek sekali kurang memuaskan,2,0,,2023-10-25 15:20:17,,,,newest,com.mobile.legends,October
786,ba8f1e05-5b26-4de7-b811-af2c947ace55,Joehari,https://play-lh.googleusercontent.com/a-/ALV-UjVkPfETCamVyB6tZQbZQHrg30bV5KHwhnSAkznyO14tZAE,yahahahahaahah Kena tuntut riot,3,0,1.5.24.5712,2023-10-25 15:21:18,,,1.5.24.5712,newest,com.mobile.legends,October
787,f7547d77-de21-4ac5-973f-e4f9c7a75395,Xyyjri,https://play-lh.googleusercontent.com/a/ACg8ocKHUJ9zN41YtDFvXm6ox2Mr75GpSHc4umNeivZB9Psj=mo,Monton anehhh padahal gw ngetik engg aneh aneh tapi di mute kocak,2,0,1.7.82.8551,2023-10-25 15:23:14,,,1.7.82.8551,newest,com.mobile.legends,October
788,75dd69bd-f84a-461a-ba6a-92e13bc03bca,Tawali Liza,https://play-lh.googleusercontent.com/a-/ALV-UjWawm2kN0u8O6n472uWUbhS6a_i-X4mzz_XCYfUYRbMMw,Ok,4,0,,2023-10-25 15:29:49,,,,newest,com.mobile.legends,October
789,2c193684-ffcd-4562-908a-a77baad034d8,Rahmat tri Wibowo,https://play-lh.googleusercontent.com/a-/ALV-UjWyVzS9DmPsjdDUdBOhoPfko0CNYzrjIBpSUvLT5BbiMA,"Kenapa waktu unduhan data ga full - full , padahal sudah milih mode unduh semua kenapa resource data nya ga full jadi memakan banyak kuota,nge bug atau gimana si",3,0,,2023-10-25 15:33:05,,,,newest,com.mobile.legends,October
790,21c1a43b-9e49-4fe7-984e-cfb49b9c2fcc,Nadia natasha,https://play-lh.googleusercontent.com/a-/ALV-UjUeeQHueJgKRKPvljULllHA7LrMeLeUVWvGHkavJmJtTQ,"Ini gimana sihhhh tolong, udah beberapa kali waktu login malah gelap terus, pernah harus download data nya ulang perkara waktu login gelap, ini gimana masa hari ini download data besoknya harus download jga",2,0,1.7.69.8401,2023-10-25 15:38:39,,,1.7.69.8401,newest,com.mobile.legends,October
791,a7e1733b-af43-4e6b-9de2-418bf81a540a,rubi Gunawan,https://play-lh.googleusercontent.com/a-/ALV-UjXe4LTJ2xjv7cfRzNrYwhXVaJ9gHgZFkv_o44iwVeMR01Y,Mobile legend makin ksini makin berat Setalah pemabaruan makin bert nih game Make jarign m3 ga ngangkat sinyalnya Pl,3,0,1.8.22.8944,2023-10-25 15:42:12,,,1.8.22.8944,newest,com.mobile.legends,October
792,e7b8d065-2b88-4e49-8dc0-b46cb86adb75,Riyad Mahrez,https://play-lh.googleusercontent.com/a-/ALV-UjX0sFzTGz1OH_Q9n-rIv567Ch__dEQ1Q1DbMjl-rk_mhhk,Saya player minta bantuan nya kepada sistem.saat Rank jika ada salah satu player yang cara bermain sangat tidak bagus atau membuat rugi poin nanti nya sistem lansung aja beri hukuman..di komentar saat rank nanti malah kenak hukuman..lama lama makin gak ashik kalau begini..,3,0,1.8.22.8944,2023-10-25 15:42:22,,,1.8.22.8944,newest,com.mobile.legends,October
793,56f7ef2a-71bf-4cb6-840a-cca773b4f6d8,Arya Pratama,https://play-lh.googleusercontent.com/a/ACg8ocJDxJVmV6EDg6CFGCoCNGu7t_pafaF6kvMXEVptVva0=mo,𝐂𝐚𝐩𝐞 𝐝𝐚𝐫𝐢 𝐭𝐚𝐝𝐢 𝐤𝐞𝐭𝐞𝐦𝐮 𝐦𝐮𝐬𝐡 𝐲𝐠 𝐠𝐠 𝐦𝐮𝐥𝐮 𝐦𝐚𝐬𝐚 𝐦𝐞𝐦𝐚𝐧𝐠 𝐤𝐞𝐭𝐞𝐦𝐮 𝐭𝐢𝐦 𝐠𝐞𝐥𝐚𝐬 𝐤𝐚𝐥𝐚𝐮 𝐤𝐥𝐚𝐡 𝐤𝐞𝐭𝐞𝐦𝐮 𝐭𝐞𝐚𝐦 𝐦𝐮𝐬𝐮𝐡 𝐛𝐮𝐤𝐚𝐧 𝐦𝐚𝐢𝐧 𝐒𝐞𝐭𝐢𝐚𝐩 𝐤𝐚𝐥𝐢 𝐮𝐝𝐚𝐡 𝐣𝐚𝐠𝐨 𝐦𝐚𝐬𝐚 𝐤𝐞𝐧𝐚 𝐜𝐨𝐦𝐞𝐛𝐚𝐜𝐤 𝐂𝐚𝐩𝐞 𝐝𝐚𝐫𝐢 𝐬𝐢𝐚𝐧𝐠 𝐧𝐞𝐠𝐬𝐭𝐮𝐜𝐤 𝐧𝐲𝐚 𝐦𝐲𝐭𝐡𝐢𝐱 𝟏𝟎 𝐝𝐚𝐧 𝟏𝟏 𝐝𝐨𝐚𝐧𝐠 𝐝𝐚𝐫𝐢 𝐭𝐚𝐝𝐢 𝐦𝐚𝐫𝐚𝐡 𝐧𝐠𝐚𝐧𝐭𝐮𝐤 𝐠𝐚𝐣𝐞𝐥𝐚𝐬 𝐤𝐚𝐫𝐞𝐧𝐚 𝐭𝐢𝐦 𝐦𝐬𝐢𝐡 𝐛𝐨𝐭 𝐝𝐢 𝐦𝐲𝐭𝐡𝐢𝐜,2,0,1.8.22.8944,2023-10-25 15:44:07,,,1.8.22.8944,newest,com.mobile.legends,October
794,b4e4b563-1d37-4868-98fe-283925eb820a,Mahdi Alfat,https://play-lh.googleusercontent.com/a/ACg8ocJZzGkb2GYev5O6hZ2eCI3EVXxr4qf4hHqU-E3aWgRP=mo,Tolong moonton di perbaiki omongan nya yg kasar mana yg bukan mana,4,0,1.8.22.8944,2023-10-25 15:44:07,,,1.8.22.8944,newest,com.mobile.legends,October
795,da517816-f0c8-42d3-8006-2ab45f52cad6,Aditia Rehan,https://play-lh.googleusercontent.com/a/ACg8ocLic-ihp_S0mvT43sYe54lp3B9CFOnQqTAvolHS99-6=mo,Tolong diperbaiki tim yg seimbang masak tim gw computer truss,2,0,1.7.94.8681,2023-10-25 15:53:15,,,1.7.94.8681,newest,com.mobile.legends,October
796,9471012f-2425-4c4e-9c9d-9576b9a5e4ed,Akun Gogle,https://play-lh.googleusercontent.com/a/ACg8ocIKBetIBj7miyQdDNZFFC8rI1Fa18c-oz6jD39ouVbS=mo,"Buat pihak monton Hero hanabi mending di hapus aja, soalnya bukannya saya kesel sama Hero hanabi, tapi prespick nya lihat lihat itu lagi itu lagi yang muncul kaya ga ada mm lain aja, makin gila' apa lagi kalo di tim saya bikin pusing",3,0,1.7.94.8681,2023-10-25 16:05:08,,,1.7.94.8681,newest,com.mobile.legends,October
797,5c64d54e-60aa-4ec7-a9a9-d9b4f7fc3562,Darwin Hetriyadi,https://play-lh.googleusercontent.com/a/ACg8ocKVzGa0ET9zGcW4U3vMIr1GpOUcHk_wjPxtQo35T6c7=mo,Nonton kasih teman bisa main dan lawan yg seimbang.,2,0,1.8.22.8944,2023-10-25 16:06:20,,,1.8.22.8944,newest,com.mobile.legends,October
798,6f87e0cf-c4aa-4769-a902-9a03a19d7b93,Ndii Lavendos,https://play-lh.googleusercontent.com/a-/ALV-UjX0as7I7OwAXGkAJum7Mo4O09p0D5DWloNuXukxoshINg,Game Nyah Bagusss Tapi Sayang Gak Bisa Main Offline Lagihh,3,0,,2023-10-25 16:11:55,,,,newest,com.mobile.legends,October
799,80a7892b-f7f8-4219-a791-989259bd776a,Husen ASIDIQ,https://play-lh.googleusercontent.com/a/ACg8ocK27Kw93exFduH0AJjPYnbkc18QaeiBG6C7w7vpN5HF=mo,"halo mononton aku pelayer yg bukan pro maupun GG kenapa saya mendapat tim yg kurang berpengalaman dan mendapatkan lawan yg terlalu berat apakah karena akun saya terlalu menganggu anda dan anda membuat lelucon bagi akun saya dan saya saya sudah 5 th bermaen ml tidak pernah mendapatkan lawan atau tim yg sepadan , pernah sepadan itu pun sangat jarang saya jumpai apakah akun saya sgat mengganggu mu???",3,0,1.7.44.8111,2023-10-25 16:13:11,,,1.7.44.8111,newest,com.mobile.legends,October
800,fc69574b-0a0f-4f1b-8da7-e3e088e9719c,Iyyu Alle,https://play-lh.googleusercontent.com/a-/ALV-UjU0D6mGUzXHooWopi8uubAAE4GBsC8t3Urq1jtSAR_ixwo,Kenapa susah masuk loginnya,2,0,1.8.22.8944,2023-10-25 16:14:37,,,1.8.22.8944,newest,com.mobile.legends,October
801,3ae08695-54e0-41a7-8a0e-6f39c65fe9d7,muhammad iir,https://play-lh.googleusercontent.com/a/ACg8ocJmxCEQALLqPQKPb8Yt7Uu-Jqqtn84ocuXHk3NyN_P9=mo,cukup bagus,3,0,,2023-10-25 16:43:42,,,,newest,com.mobile.legends,October
802,23bbb87c-df06-4d9b-b07c-809a54db2152,Aris Zabanesa,https://play-lh.googleusercontent.com/a/ACg8ocJ-tZPVzBW0ww0odLC_Y3w1ZFsIYFHJNl8EKtvaT8cj=mo,Sangat bagus,4,0,,2023-10-25 16:53:02,,,,newest,com.mobile.legends,October
803,3ef033e3-7aee-4f17-b039-4f1940f7e59c,Akimin Gz Gz,https://play-lh.googleusercontent.com/a-/ALV-UjVRFX3TpP3GTfWw166FSw6hnLZFLWFpjcmszBzp5VSXXg,"Nih montodd kalo ngasih tim ga bener, gw lostrek 13× win 4× kalo ngasih tim yng bener dikit napa, game rusak",2,0,,2023-10-25 16:59:36,,,,newest,com.mobile.legends,October
804,c1adf6ad-c3eb-4bec-b720-6a2f41c90f56,Ciko Brhn,https://play-lh.googleusercontent.com/a/ACg8ocIvtiKtekplga5r4n9gDTMZMAO8Kmh6Bcauyd1dvV-l=mo,Monton ga jls ngsh tim sllu asu lol msl gua ngsh bintang full jing monton goBlog monton seTannnnn? Bngke bngke asuuu,2,0,1.8.22.8944,2023-10-25 17:00:45,,,1.8.22.8944,newest,com.mobile.legends,October
805,d2e4f504-589d-40c1-aa63-7bfac6057854,Luzviatu Zahra,https://play-lh.googleusercontent.com/a/ACg8ocL7r1oLfEngvyW7pNquJ5liZTn7bhggvy3tOClBnfzh=mo,Kurang bagus aja si,3,0,1.8.22.8944,2023-10-25 17:03:16,,,1.8.22.8944,newest,com.mobile.legends,October
806,b014dd63-cd79-4fe6-a9dd-6cdfac328df9,Muhamad Hanifidzaki,https://play-lh.googleusercontent.com/a-/ALV-UjWaLZmd6P_Dc_h2HZ2CwFUnue16Rw93dzB4BRBvzrRiTPA,"Game busuk , dark sistem terus ngentod , mbok Yo seng nggenah payer e , monttoon babi, dikit2 kena mute, makannya kalau dratf ngasih yg gak bego kontolll, jembutt",2,0,,2023-10-25 17:07:42,"Dear Hero,
Terima kasih atas tanggapan Anda.
Silakan hubungi kami melalui CS dalam game, ini akan membantu kami mengumpulkan informasi yang lebih detail sehingga kami dapat mengidentifikasi masalah secepat mungkin. Bantuan Anda akan sangat membantu kami untuk menyelesaikan masalah dan kami sangat menyesal atas ketidaknyamanan yang ditimbulkan.",2023-06-12 03:53:54,,newest,com.mobile.legends,October
807,f14a7714-19f9-482f-b5a9-6c5ca79269d6,Pengguna Google,https://play-lh.googleusercontent.com/EGemoI2NTXmTsBVtJqk8jxF9rh8ApRWfsIMQSt2uE4OcpQqbFu7f7NbTK05lx80nuSijCz7sc3a277R67g,Mode offline nya kok ilang,4,0,,2023-10-25 17:10:48,,,,newest,com.mobile.legends,October
808,2a40e4f5-326f-4d29-b5d8-5544e7841f24,Wisnu Bayu,https://play-lh.googleusercontent.com/a-/ALV-UjUVanzeb475ctBqC_v5YxKd9C-BkglqWlrncFdMxIL2RLit,Makin kesini makin parah si.Tiap rnk ktmu mythic honor tapi mainnya gabeda dri gm.,3,0,,2023-10-25 17:10:53,,,,newest,com.mobile.legends,October
809,7e39b1cc-e428-44bf-8261-89ec30676bb7,Kurniawan Iwan,https://play-lh.googleusercontent.com/a/ACg8ocLxlu_7gXEsYjduUNPCH3Ph6Uo2GWe77q2oqaqpeIul=mo,Mau naik mytic ajh dipersulit naik turun naik turun cape bosss push rank tiap hari gak ada ngaruhnya kalo terus terusan ngasih tim gak seimbang ngabisin kuota ajh.,2,0,1.7.59.8262,2023-10-25 17:13:35,"Dear Hero,
Kami bertekad untuk menciptakan lingkungan permainan yang adil untuk setiap pemain dan terus meningkatkan pengalaman permainan Anda, terima kasih atas dukungan Anda sampai saat ini, Anda dapat menghubungi kami melalui layanan CS dalam game dan memberikan lebih banyak ulasan dan informasi terperinci. Kami Akan membantu Anda secepatnya.",2023-03-13 08:30:07,1.7.59.8262,newest,com.mobile.legends,October
810,9ced2a76-7f6b-46e5-8127-43bc0eb0b0a3,langgra gibran,https://play-lh.googleusercontent.com/a-/ALV-UjUuUoegJDUNfSrsZtbB-ovhTnj-MhVrRGbRFE5-taT027s,"dari segi gameplay udh bagus, cuman saya masih sering mengalami malfungsi jaringan, dan saya merasa kesulitan sekali untuk memenangkan game ini dikarenakan matchmaking yang masih tidak seimbang, dan lagi saya merasa kecewa dengan pihak customer service dikarenakan tidak menjalankan tugasnya dengan baik, saya melaporkan pemain yang benar-benar melalukan kesalahan tapi respon dri customer service itu sendiri malah sebaliknya dan menyatakan bahwa pemain tersebut tidak salah, semoga di perbaiki",2,5,1.8.22.8944,2023-10-25 17:26:14,,,1.8.22.8944,newest,com.mobile.legends,October
811,43dafc97-d312-48dc-963d-6d3adaa15e54,ricky pangarepo,https://play-lh.googleusercontent.com/a/ACg8ocK5qeq1MMu_qPeVHnuJ7DqAdoAJx4GPQxqkF6C82paD=mo,Kesal banget sama game ini,2,0,1.8.22.8944,2023-10-25 17:26:14,,,1.8.22.8944,newest,com.mobile.legends,October
812,784b2b85-ee8e-4f1c-b6da-c54236320dee,Fredy Priatno,https://play-lh.googleusercontent.com/a-/ALV-UjUwwmc0rM_p87gnUxxadN2SLkFSL14KQzDli3caFA0poGo,"Masih sering lag ketika ketemu lawan, apa lagi waktu war",4,0,1.8.22.8944,2023-10-25 17:38:25,,,1.8.22.8944,newest,com.mobile.legends,October
813,50b5001b-5e3e-43b8-bfc9-da88aa40904a,Khaalilluyaaa,https://play-lh.googleusercontent.com/a/ACg8ocL0KfR-IDSSl8iH8NJiRaM-1ikChZDuD0HxNNCuBPykqw=mo,Komposisi team sering tidak seimbang dengan team musuh..sering terjadi pada solo player dikasih team nub sedangkan team musuh sangat keras..tolong diperbaiki moonton yang terhormat,3,0,1.8.22.8944,2023-10-25 17:46:21,,,1.8.22.8944,newest,com.mobile.legends,October
814,55477c44-f01e-4700-8d26-ab1240b4106d,yansyah,https://play-lh.googleusercontent.com/a-/ALV-UjXSzRU1wZSRFRE9bp-6hhNqgwkEIgmEUekZE3dckfJDfUQ,Nice:),4,0,1.8.22.8944,2023-10-25 17:48:39,,,1.8.22.8944,newest,com.mobile.legends,October
815,79b70f9a-c0e4-4135-b285-5c08ac25dc04,Ascarya Chandra,https://play-lh.googleusercontent.com/a/ACg8ocJo_yE_qmn_b3g-dj8GQVRbVIZI3pc0_0Q-sRk_yvnN=mo,Lose terus dah mls malah di kasih coklat terul lagi masih mending coklat Valentine giliran org ga di kasoh gr² beda gold 100 donk,2,0,,2023-10-25 18:00:33,,,,newest,com.mobile.legends,October
816,d6bd6447-6619-40e7-b2bd-79252fca6915,Falsindra Indra,https://play-lh.googleusercontent.com/a-/ALV-UjUn4XF5LeSHlqEs1eHEdJAMDl4ylxtFrE_qHi-0ttqadOE,HAPUS ANYING GAME BOT DARI PLAY STORE GAME KAFIR,2,0,1.8.22.8944,2023-10-25 18:01:53,,,1.8.22.8944,newest,com.mobile.legends,October
817,007b192e-3393-4bf4-80d5-3a30bea7bc4a,Ujang Suhendar,https://play-lh.googleusercontent.com/a/ACg8ocIoxUTErjwoCNOXVsvtzhh37pmSFZiyFIp3DKXwA13O=mo,"Games nyah sudah bagus seru untuk di mainkan, tapi kalo bisa jangan terlalu sering updet ajah, terima kasih",4,0,1.7.84.8553,2023-10-25 18:10:25,,,1.7.84.8553,newest,com.mobile.legends,October
818,9cb98e69-9c38-4ae7-810b-511057784248,ARUL KIDAY TV,https://play-lh.googleusercontent.com/a/ACg8ocIPJrb87QyUx7cBQ1OujqE2kRElo2a2OHFehQ_3XsG0dA=mo,"Moonton"" Ngasih tim dan lawan gak seimbang gak ngotak naik turun"" Banyak bet ngambil cuan lu moonton",2,0,1.8.22.8944,2023-10-25 18:36:46,"Dear Hero, Kami bertekad untuk menciptakan lingkungan permainan yang adil untuk setiap pemain dan terus meningkatkan pengalaman bermain Anda, terima kasih atas dukungannya sampai saat ini, kamu dapat menghubungi kami melalui layanan CS dalam game dan memberikan lebih banyak ulasan dan informasi terperinci. Kami Akan membantu kamu secepatnya.",2023-10-26 04:08:35,1.8.22.8944,newest,com.mobile.legends,October
819,3e2ea8b4-36fb-4137-81ee-6f962c37bc92,Muhammad Anugrah,https://play-lh.googleusercontent.com/a/ACg8ocIsUsrg7PopL1OBJWRsoS5WWHdZ-S9z_scmCL307PZy=mo,Makin gak jelas dpet tim nya huu,3,0,,2023-10-25 18:38:42,,,,newest,com.mobile.legends,October
820,6b13e1c7-5a5d-472d-a12e-13379d8d891a,Irvan Brian1999,https://play-lh.googleusercontent.com/a/ACg8ocLOlxmb7OAaiqwuKMdmNYwstQH67KbjWJiH8aEozkTs=mo,Internet,4,0,,2023-10-25 19:15:46,,,,newest,com.mobile.legends,October
821,844fb0c7-0cf8-4a87-bcc6-707a08b28f0d,DaffiQa Dafi,https://play-lh.googleusercontent.com/a/ACg8ocK-K3ch49yp7JS8eloOsngqn8rTmi81ZQloz6sEYFOw=mo,Gak jelas kau ngasih hukuman orang gara2 player gak senang asal asal lapor di hukum berat jugak.hukum bagi pelanggar AFK dan cheat Saja..jangan semua di hukum gegara laporan bot lah player nobb lah.. lama lama game burik ini..ngak usah kau kasih kasih black sistem garai orang suntuk ma game mu ini.,2,0,1.8.8.8811,2023-10-25 19:22:03,"Dear Hero,
Kami mohon maaf atas ketidaknyamanan yang Anda alami. Kami berharap Anda bisa memberikan tangkapan layar atau informasi yang lebih spesifik melalui CS in-game atau email untuk membantu kami mengonfirmasi masalah. Kami akan mengumpulkan pertanyaan dan feedback Anda untuk terus meningkatkan pengalaman game.
Terima kasih!",2023-10-26 02:35:10,1.8.8.8811,newest,com.mobile.legends,October
822,9d16811f-1820-457f-9cc6-fdf2b299e450,Ferdi Sambo,https://play-lh.googleusercontent.com/a-/ALV-UjWIr-rAq4-swkP_YF9e2q2W7J0EKzDpXhKApyMpT48GZA,GA MASUK AKAL TIM MUSUH JAGO TIM SENDIRI BOTT TOLONG LAH MONTON HONOR MASA SATU TIM SAMA LEJEN 5 UDAH 4 HARI STUK BINTANG 25 TERUS TOLONG DIPERBAIKI MAHTC MAching nya,2,0,,2023-10-25 19:51:18,"Dear Hero,
Kami bertekad untuk menciptakan lingkungan permainan yang adil untuk setiap pemain dan terus meningkatkan pengalaman permainan Anda, terima kasih atas dukungan Anda sampai saat ini, Anda dapat menghubungi kami melalui layanan CS dalam game dan memberikan lebih banyak ulasan dan informasi terperinci. Kami Akan membantu Anda secepatnya.",2023-10-26 02:34:38,,newest,com.mobile.legends,October
823,3d1f344d-d16a-4db9-81c0-6fe7c59d98f4,D A N N N,https://play-lh.googleusercontent.com/a-/ALV-UjWZZejpni6RHGXUYVHFG68GCDhSaaSRD__3s6HyXLzYcz4c,"Tolong lah kasih tim yg ngotak mmk, niat mau seneng malah makin males main.",2,0,1.8.22.8944,2023-10-25 20:05:45,"Dear Hero,
Kami bertekad untuk menciptakan lingkungan permainan yang adil untuk setiap pemain dan terus meningkatkan pengalaman permainan Anda, terima kasih atas dukungan Anda sampai saat ini, Anda dapat menghubungi kami melalui layanan CS dalam game dan memberikan lebih banyak ulasan dan informasi terperinci. Kami Akan membantu Anda secepatnya.",2023-10-26 02:32:44,1.8.22.8944,newest,com.mobile.legends,October
824,50e21545-94f6-44f2-b498-4a6a592e6653,akhram takhi takhi,https://play-lh.googleusercontent.com/a/ACg8ocL23ATMpplGcyOP3DEGq80aRVaz9H9NwUOMwdJLlcaC=mo,"Montoon sekarang terlalu berat apk ny terlalu banyak updet ini itu sehingga menyebabkan laq untuk pengguna ram kecil ram 4GB aj laq, mohon di kondisikan lgi apk mlbb agar peminat ny lebih nyaman untk bermain di mlbb",2,0,1.8.22.8944,2023-10-25 20:07:45,"Dear Hero,
Terima kasih atas tanggapan Anda, sudah kami catat. Kami akan membahas masalah dengan serius dan berusaha untuk meningkatkan pengalaman game yang sesuai. Jika Anda memiliki pertanyaan atau saran lebih lanjut, jangan ragu untuk menghubungi CS in-game, kami akan membantu Anda sesegera mungkin.",2023-10-26 02:32:37,1.8.22.8944,newest,com.mobile.legends,October
